src/CLU/StaticAnalysis/outputTypes.csv
Validator,Assembly,Target,Severity,Description,Remediation
"Cmdlet Output Validator","Microsoft.Azure.Commands.Compute","Microsoft.Azure.Management.Compute.Models.DataDisk","0","Type 'Microsoft.Azure.Management.Compute.Models.DataDisk' contains invalid list column format.  Item label: 'VirtualHardDisk'","Replace unsupported format elements in C:\pd\azure-powershell\src\CLU\StaticAnalysis\..\Microsoft.Azure.Commands.Compute\Microsoft.Azure.Commands.Compute.format.ps1xml table control for Microsoft.Azure.Management.Compute.Models.DataDisk"
"Cmdlet Output Validator","Microsoft.Azure.Commands.Compute","Microsoft.Azure.Commands.Compute.Extension.DSC.VirtualMachineDscExtensionStatusContext","0","Type 'Microsoft.Azure.Commands.Compute.Extension.DSC.VirtualMachineDscExtensionStatusContext' contains invalid list column format.  Item label: 'Timestamp'","Replace unsupported format elements in C:\pd\azure-powershell\src\CLU\StaticAnalysis\..\Microsoft.Azure.Commands.Compute\Microsoft.Azure.Commands.Compute.format.ps1xml table control for Microsoft.Azure.Commands.Compute.Extension.DSC.VirtualMachineDscExtensionStatusContext"
"Cmdlet Output Validator","Microsoft.Azure.Commands.Compute","Microsoft.Azure.Management.Compute.Models.DataDisk","0","Type 'Microsoft.Azure.Management.Compute.Models.DataDisk' contains invalid list column format.  Item label: 'VirtualHardDisk'","Replace unsupported format elements in C:\pd\azure-powershell\src\CLU\StaticAnalysis\..\Microsoft.Azure.Commands.Compute\Microsoft.Azure.Commands.Compute.format.ps1xml table control for Microsoft.Azure.Management.Compute.Models.DataDisk"
"Cmdlet Output Validator","Microsoft.Azure.Commands.Compute","Microsoft.Azure.Management.Compute.Models.DataDisk","0","Type 'Microsoft.Azure.Management.Compute.Models.DataDisk' contains invalid list column format.  Item label: 'VirtualHardDisk'","Replace unsupported format elements in C:\pd\azure-powershell\src\CLU\StaticAnalysis\..\Microsoft.Azure.Commands.Compute\Microsoft.Azure.Commands.Compute.format.ps1xml table control for Microsoft.Azure.Management.Compute.Models.DataDisk"
"Cmdlet Output Validator","Microsoft.Azure.Commands.Compute","Microsoft.Azure.Commands.Compute.Extension.DSC.VirtualMachineDscExtensionStatusContext","0","Type 'Microsoft.Azure.Commands.Compute.Extension.DSC.VirtualMachineDscExtensionStatusContext' contains invalid list column format.  Item label: 'Timestamp'","Replace unsupported format elements in C:\pd\azure-powershell\src\CLU\StaticAnalysis\..\Microsoft.Azure.Commands.Compute\Microsoft.Azure.Commands.Compute.format.ps1xml table control for Microsoft.Azure.Commands.Compute.Extension.DSC.VirtualMachineDscExtensionStatusContext"
"Cmdlet Output Validator","Microsoft.Azure.Commands.Compute","Get-AzureRmAvailabilitySet","3","The output type Microsoft.Azure.Commands.Compute.Models.PSAvailabilitySet for cmdlet Get-AzureRmAvailabilitySet has properties that are complex types, this may result in unexpected siaply output.","Verify cmdlet output for Get-AzureRmAvailabilitySet"
"Cmdlet Output Validator","Microsoft.Azure.Commands.Compute","New-AzureRmAvailabilitySet","3","The output type Microsoft.Azure.Commands.Compute.Models.PSAvailabilitySet for cmdlet New-AzureRmAvailabilitySet has properties that are complex types, this may result in unexpected siaply output.","Verify cmdlet output for New-AzureRmAvailabilitySet"
"Cmdlet Output Validator","Microsoft.Azure.Commands.Compute","Get-AzureRmVMExtension","1","Missing output format for cmdlet output type Microsoft.Azure.Commands.Compute.Models.PSVirtualMachineExtension","Add an output format for type Microsoft.Azure.Commands.Compute.Models.PSVirtualMachineExtension in Microsoft.Azure.Commands.Compute.format.ps1xml, or verify the default output display is correct."
"Cmdlet Output Validator","Microsoft.Azure.Commands.Compute","Get-AzureRmVMExtension","3","The output type Microsoft.Azure.Commands.Compute.Models.PSVirtualMachineExtension for cmdlet Get-AzureRmVMExtension has properties that are complex types, this may result in unexpected siaply output.","Verify cmdlet output for Get-AzureRmVMExtension"
"Cmdlet Output Validator","Microsoft.Azure.Commands.Compute","Remove-AzureRmVMExtension","3","The output type Microsoft.Azure.Commands.Compute.Models.PSComputeLongRunningOperation for cmdlet Remove-AzureRmVMExtension has properties that are complex types, this may result in unexpected siaply output.","Verify cmdlet output for Remove-AzureRmVMExtension"
"Cmdlet Output Validator","Microsoft.Azure.Commands.Compute","Set-AzureRmVMExtension","3","The output type Microsoft.Azure.Commands.Compute.Models.PSComputeLongRunningOperation for cmdlet Set-AzureRmVMExtension has properties that are complex types, this may result in unexpected siaply output.","Verify cmdlet output for Set-AzureRmVMExtension"
"Cmdlet Output Validator","Microsoft.Azure.Commands.Compute","Get-AzureRmVMCustomScriptExtension","1","Missing output format for cmdlet output type Microsoft.Azure.Commands.Compute.Models.VirtualMachineCustomScriptExtensionContext","Add an output format for type Microsoft.Azure.Commands.Compute.Models.VirtualMachineCustomScriptExtensionContext in Microsoft.Azure.Commands.Compute.format.ps1xml, or verify the default output display is correct."
"Cmdlet Output Validator","Microsoft.Azure.Commands.Compute","Get-AzureRmVMCustomScriptExtension","3","The output type Microsoft.Azure.Commands.Compute.Models.VirtualMachineCustomScriptExtensionContext for cmdlet Get-AzureRmVMCustomScriptExtension has properties that are complex types, this may result in unexpected siaply output.","Verify cmdlet output for Get-AzureRmVMCustomScriptExtension"
"Cmdlet Output Validator","Microsoft.Azure.Commands.Compute","Get-AzureRmVMAccessExtension","1","Missing output format for cmdlet output type Microsoft.Azure.Commands.Compute.Models.VirtualMachineAccessExtensionContext","Add an output format for type Microsoft.Azure.Commands.Compute.Models.VirtualMachineAccessExtensionContext in Microsoft.Azure.Commands.Compute.format.ps1xml, or verify the default output display is correct."
"Cmdlet Output Validator","Microsoft.Azure.Commands.Compute","Get-AzureRmVMAccessExtension","3","The output type Microsoft.Azure.Commands.Compute.Models.VirtualMachineAccessExtensionContext for cmdlet Get-AzureRmVMAccessExtension has properties that are complex types, this may result in unexpected siaply output.","Verify cmdlet output for Get-AzureRmVMAccessExtension"
"Cmdlet Output Validator","Microsoft.Azure.Commands.Compute","Get-AzureRmVmExtensionImage","3","The output type Microsoft.Azure.Commands.Compute.Models.PSVirtualMachineExtensionImage for cmdlet Get-AzureRmVmExtensionImage has properties that are complex types, this may result in unexpected siaply output.","Verify cmdlet output for Get-AzureRmVmExtensionImage"
"Cmdlet Output Validator","Microsoft.Azure.Commands.Compute","Get-AzureRmVmExtensionImage","3","The output type Microsoft.Azure.Commands.Compute.Models.PSVirtualMachineExtensionImageDetails for cmdlet Get-AzureRmVmExtensionImage has properties that are complex types, this may result in unexpected siaply output.","Verify cmdlet output for Get-AzureRmVmExtensionImage"
"Cmdlet Output Validator","Microsoft.Azure.Commands.Compute","Get-AzureRmVMExtensionImageType","1","Missing output format for cmdlet output type Microsoft.Azure.Commands.Compute.Models.PSVirtualMachineExtensionImageType","Add an output format for type Microsoft.Azure.Commands.Compute.Models.PSVirtualMachineExtensionImageType in Microsoft.Azure.Commands.Compute.format.ps1xml, or verify the default output display is correct."
"Cmdlet Output Validator","Microsoft.Azure.Commands.Compute","Get-AzureRmVMExtensionImageType","3","The output type Microsoft.Azure.Commands.Compute.Models.PSVirtualMachineExtensionImageType for cmdlet Get-AzureRmVMExtensionImageType has properties that are complex types, this may result in unexpected siaply output.","Verify cmdlet output for Get-AzureRmVMExtensionImageType"
"Cmdlet Output Validator","Microsoft.Azure.Commands.Compute","Get-AzureRmVMImage","3","The output type Microsoft.Azure.Commands.Compute.Models.PSVirtualMachineImage for cmdlet Get-AzureRmVMImage has properties that are complex types, this may result in unexpected siaply output.","Verify cmdlet output for Get-AzureRmVMImage"
"Cmdlet Output Validator","Microsoft.Azure.Commands.Compute","Get-AzureRmVMImage","3","The output type Microsoft.Azure.Commands.Compute.Models.PSVirtualMachineImageDetail for cmdlet Get-AzureRmVMImage has properties that are complex types, this may result in unexpected siaply output.","Verify cmdlet output for Get-AzureRmVMImage"
"Cmdlet Output Validator","Microsoft.Azure.Commands.Compute","Get-AzureRmVMImageOffer","3","The output type Microsoft.Azure.Commands.Compute.Models.PSVirtualMachineImageOffer for cmdlet Get-AzureRmVMImageOffer has properties that are complex types, this may result in unexpected siaply output.","Verify cmdlet output for Get-AzureRmVMImageOffer"
"Cmdlet Output Validator","Microsoft.Azure.Commands.Compute","Get-AzureRmVMImagePublisher","3","The output type Microsoft.Azure.Commands.Compute.Models.PSVirtualMachineImagePublisher for cmdlet Get-AzureRmVMImagePublisher has properties that are complex types, this may result in unexpected siaply output.","Verify cmdlet output for Get-AzureRmVMImagePublisher"
"Cmdlet Output Validator","Microsoft.Azure.Commands.Compute","Get-AzureRmVMImageSku","3","The output type Microsoft.Azure.Commands.Compute.Models.PSVirtualMachineImageSku for cmdlet Get-AzureRmVMImageSku has properties that are complex types, this may result in unexpected siaply output.","Verify cmdlet output for Get-AzureRmVMImageSku"
"Cmdlet Output Validator","Microsoft.Azure.Commands.Compute","Get-AzureRmVMUsage","3","The output type Microsoft.Azure.Commands.Compute.Models.PSUsage for cmdlet Get-AzureRmVMUsage has properties that are complex types, this may result in unexpected siaply output.","Verify cmdlet output for Get-AzureRmVMUsage"
"Cmdlet Output Validator","Microsoft.Azure.Commands.Compute","Restart-AzureRmVM","3","The output type Microsoft.Azure.Commands.Compute.Models.PSComputeLongRunningOperation for cmdlet Restart-AzureRmVM has properties that are complex types, this may result in unexpected siaply output.","Verify cmdlet output for Restart-AzureRmVM"
"Cmdlet Output Validator","Microsoft.Azure.Commands.Compute","Save-AzureRmVMImage","3","The output type Microsoft.Azure.Commands.Compute.Models.PSComputeLongRunningOperation for cmdlet Save-AzureRmVMImage has properties that are complex types, this may result in unexpected siaply output.","Verify cmdlet output for Save-AzureRmVMImage"
"Cmdlet Output Validator","Microsoft.Azure.Commands.Compute","Add-AzureRmVMAdditionalUnattendContent","3","The output type Microsoft.Azure.Commands.Compute.Models.PSVirtualMachine for cmdlet Add-AzureRmVMAdditionalUnattendContent has properties that are complex types, this may result in unexpected siaply output.","Verify cmdlet output for Add-AzureRmVMAdditionalUnattendContent"
"Cmdlet Output Validator","Microsoft.Azure.Commands.Compute","Add-AzureRmVMDataDisk","3","The output type Microsoft.Azure.Commands.Compute.Models.PSVirtualMachine for cmdlet Add-AzureRmVMDataDisk has properties that are complex types, this may result in unexpected siaply output.","Verify cmdlet output for Add-AzureRmVMDataDisk"
"Cmdlet Output Validator","Microsoft.Azure.Commands.Compute","Add-AzureRmVMNetworkInterface","3","The output type Microsoft.Azure.Commands.Compute.Models.PSVirtualMachine for cmdlet Add-AzureRmVMNetworkInterface has properties that are complex types, this may result in unexpected siaply output.","Verify cmdlet output for Add-AzureRmVMNetworkInterface"
"Cmdlet Output Validator","Microsoft.Azure.Commands.Compute","Add-AzureRmVMSecret","3","The output type Microsoft.Azure.Commands.Compute.Models.PSVirtualMachine for cmdlet Add-AzureRmVMSecret has properties that are complex types, this may result in unexpected siaply output.","Verify cmdlet output for Add-AzureRmVMSecret"
"Cmdlet Output Validator","Microsoft.Azure.Commands.Compute","Add-AzureRmVMSshPublicKey","3","The output type Microsoft.Azure.Commands.Compute.Models.PSVirtualMachine for cmdlet Add-AzureRmVMSshPublicKey has properties that are complex types, this may result in unexpected siaply output.","Verify cmdlet output for Add-AzureRmVMSshPublicKey"
"Cmdlet Output Validator","Microsoft.Azure.Commands.Compute","New-AzureRmVMConfig","3","The output type Microsoft.Azure.Commands.Compute.Models.PSVirtualMachine for cmdlet New-AzureRmVMConfig has properties that are complex types, this may result in unexpected siaply output.","Verify cmdlet output for New-AzureRmVMConfig"
"Cmdlet Output Validator","Microsoft.Azure.Commands.Compute","Remove-AzureRmVMDataDisk","3","The output type Microsoft.Azure.Commands.Compute.Models.PSVirtualMachine for cmdlet Remove-AzureRmVMDataDisk has properties that are complex types, this may result in unexpected siaply output.","Verify cmdlet output for Remove-AzureRmVMDataDisk"
"Cmdlet Output Validator","Microsoft.Azure.Commands.Compute","Remove-AzureRmVMNetworkInterface","3","The output type Microsoft.Azure.Commands.Compute.Models.PSVirtualMachine for cmdlet Remove-AzureRmVMNetworkInterface has properties that are complex types, this may result in unexpected siaply output.","Verify cmdlet output for Remove-AzureRmVMNetworkInterface"
"Cmdlet Output Validator","Microsoft.Azure.Commands.Compute","Set-AzureRmVMBootDiagnostics","3","The output type Microsoft.Azure.Commands.Compute.Models.PSVirtualMachine for cmdlet Set-AzureRmVMBootDiagnostics has properties that are complex types, this may result in unexpected siaply output.","Verify cmdlet output for Set-AzureRmVMBootDiagnostics"
"Cmdlet Output Validator","Microsoft.Azure.Commands.Compute","Set-AzureRmVMDataDisk","3","The output type Microsoft.Azure.Commands.Compute.Models.PSVirtualMachine for cmdlet Set-AzureRmVMDataDisk has properties that are complex types, this may result in unexpected siaply output.","Verify cmdlet output for Set-AzureRmVMDataDisk"
"Cmdlet Output Validator","Microsoft.Azure.Commands.Compute","Set-AzureRmVMOperatingSystem","3","The output type Microsoft.Azure.Commands.Compute.Models.PSVirtualMachine for cmdlet Set-AzureRmVMOperatingSystem has properties that are complex types, this may result in unexpected siaply output.","Verify cmdlet output for Set-AzureRmVMOperatingSystem"
"Cmdlet Output Validator","Microsoft.Azure.Commands.Compute","Set-AzureRmVMOSDisk","3","The output type Microsoft.Azure.Commands.Compute.Models.PSVirtualMachine for cmdlet Set-AzureRmVMOSDisk has properties that are complex types, this may result in unexpected siaply output.","Verify cmdlet output for Set-AzureRmVMOSDisk"
"Cmdlet Output Validator","Microsoft.Azure.Commands.Compute","Set-AzureRmVMSourceImage","3","The output type Microsoft.Azure.Commands.Compute.Models.PSVirtualMachine for cmdlet Set-AzureRmVMSourceImage has properties that are complex types, this may result in unexpected siaply output.","Verify cmdlet output for Set-AzureRmVMSourceImage"
"Cmdlet Output Validator","Microsoft.Azure.Commands.Compute","Get-AzureRmVMBootDiagnosticsData","3","The output type Microsoft.Azure.Commands.Compute.Models.PSVirtualMachine for cmdlet Get-AzureRmVMBootDiagnosticsData has properties that are complex types, this may result in unexpected siaply output.","Verify cmdlet output for Get-AzureRmVMBootDiagnosticsData"
"Cmdlet Output Validator","Microsoft.Azure.Commands.Compute","Get-AzureRmVM","3","The output type Microsoft.Azure.Commands.Compute.Models.PSVirtualMachine for cmdlet Get-AzureRmVM has properties that are complex types, this may result in unexpected siaply output.","Verify cmdlet output for Get-AzureRmVM"
"Cmdlet Output Validator","Microsoft.Azure.Commands.Compute","New-AzureRmVM","3","The output type Microsoft.Azure.Commands.Compute.Models.PSComputeLongRunningOperation for cmdlet New-AzureRmVM has properties that are complex types, this may result in unexpected siaply output.","Verify cmdlet output for New-AzureRmVM"
"Cmdlet Output Validator","Microsoft.Azure.Commands.Compute","Remove-AzureRmVM","3","The output type Microsoft.Azure.Commands.Compute.Models.PSComputeLongRunningOperation for cmdlet Remove-AzureRmVM has properties that are complex types, this may result in unexpected siaply output.","Verify cmdlet output for Remove-AzureRmVM"
"Cmdlet Output Validator","Microsoft.Azure.Commands.Compute","Update-AzureRmVM","3","The output type Microsoft.Azure.Commands.Compute.Models.PSComputeLongRunningOperation for cmdlet Update-AzureRmVM has properties that are complex types, this may result in unexpected siaply output.","Verify cmdlet output for Update-AzureRmVM"
"Cmdlet Output Validator","Microsoft.Azure.Commands.Compute","Get-AzureRmVMSize","3","The output type Microsoft.Azure.Commands.Compute.Models.PSVirtualMachineSize for cmdlet Get-AzureRmVMSize has properties that are complex types, this may result in unexpected siaply output.","Verify cmdlet output for Get-AzureRmVMSize"
"Cmdlet Output Validator","Microsoft.Azure.Commands.Compute","Add-AzureRmVhd","1","Missing output format for cmdlet output type Microsoft.Azure.Commands.Compute.Models.VhdUploadContext","Add an output format for type Microsoft.Azure.Commands.Compute.Models.VhdUploadContext in Microsoft.Azure.Commands.Compute.format.ps1xml, or verify the default output display is correct."
"Cmdlet Output Validator","Microsoft.Azure.Commands.Compute","Add-AzureRmVhd","3","The output type Microsoft.Azure.Commands.Compute.Models.VhdUploadContext for cmdlet Add-AzureRmVhd has properties that are complex types, this may result in unexpected siaply output.","Verify cmdlet output for Add-AzureRmVhd"
"Cmdlet Output Validator","Microsoft.Azure.Commands.Compute","Save-AzureRmVhd","1","Missing output format for cmdlet output type Microsoft.Azure.Commands.Compute.Models.VhdDownloadContext","Add an output format for type Microsoft.Azure.Commands.Compute.Models.VhdDownloadContext in Microsoft.Azure.Commands.Compute.format.ps1xml, or verify the default output display is correct."
"Cmdlet Output Validator","Microsoft.Azure.Commands.Compute","Save-AzureRmVhd","3","The output type Microsoft.Azure.Commands.Compute.Models.VhdDownloadContext for cmdlet Save-AzureRmVhd has properties that are complex types, this may result in unexpected siaply output.","Verify cmdlet output for Save-AzureRmVhd"
"Cmdlet Output Validator","Microsoft.Azure.Commands.Management.Storage","Get-AzureRmStorageAccount","1","Missing output format for cmdlet output type Microsoft.Azure.Commands.Management.Storage.Models.PSStorageAccount","Add an output format for type Microsoft.Azure.Commands.Management.Storage.Models.PSStorageAccount in Microsoft.Azure.Commands.Management.Storage.format.ps1xml, or verify the default output display is correct."
"Cmdlet Output Validator","Microsoft.Azure.Commands.Management.Storage","Get-AzureRmStorageAccount","3","The output type Microsoft.Azure.Commands.Management.Storage.Models.PSStorageAccount for cmdlet Get-AzureRmStorageAccount has properties that are complex types, this may result in unexpected siaply output.","Verify cmdlet output for Get-AzureRmStorageAccount"
"Cmdlet Output Validator","Microsoft.Azure.Commands.Management.Storage","Get-AzureRmStorageAccountKey","1","Missing output format for cmdlet output type Microsoft.Azure.Management.Storage.Models.StorageAccountKeys","Add an output format for type Microsoft.Azure.Management.Storage.Models.StorageAccountKeys in Microsoft.Azure.Commands.Management.Storage.format.ps1xml, or verify the default output display is correct."
"Cmdlet Output Validator","Microsoft.Azure.Commands.Management.Storage","Get-AzureRmStorageAccountKey","3","The output type Microsoft.Azure.Management.Storage.Models.StorageAccountKeys for cmdlet Get-AzureRmStorageAccountKey has properties that are complex types, this may result in unexpected siaply output.","Verify cmdlet output for Get-AzureRmStorageAccountKey"
"Cmdlet Output Validator","Microsoft.Azure.Commands.Management.Storage","New-AzureRmStorageAccount","1","Missing output format for cmdlet output type Microsoft.Azure.Commands.Management.Storage.Models.PSStorageAccount","Add an output format for type Microsoft.Azure.Commands.Management.Storage.Models.PSStorageAccount in Microsoft.Azure.Commands.Management.Storage.format.ps1xml, or verify the default output display is correct."
"Cmdlet Output Validator","Microsoft.Azure.Commands.Management.Storage","New-AzureRmStorageAccount","3","The output type Microsoft.Azure.Commands.Management.Storage.Models.PSStorageAccount for cmdlet New-AzureRmStorageAccount has properties that are complex types, this may result in unexpected siaply output.","Verify cmdlet output for New-AzureRmStorageAccount"
"Cmdlet Output Validator","Microsoft.Azure.Commands.Management.Storage","New-AzureRmStorageAccountKey","1","Missing output format for cmdlet output type Microsoft.Azure.Management.Storage.Models.StorageAccountKeys","Add an output format for type Microsoft.Azure.Management.Storage.Models.StorageAccountKeys in Microsoft.Azure.Commands.Management.Storage.format.ps1xml, or verify the default output display is correct."
"Cmdlet Output Validator","Microsoft.Azure.Commands.Management.Storage","New-AzureRmStorageAccountKey","3","The output type Microsoft.Azure.Management.Storage.Models.StorageAccountKeys for cmdlet New-AzureRmStorageAccountKey has properties that are complex types, this may result in unexpected siaply output.","Verify cmdlet output for New-AzureRmStorageAccountKey"
"Cmdlet Output Validator","Microsoft.Azure.Commands.Management.Storage","Remove-AzureRmStorageAccount","0","The cmdlet Remove-AzureRmStorageAccount has no OutputType attribute.  Please add an OutputType attribute for each of the types the cmdlet may output.","Add OutputType attribute for each output type of cmdlet Remove-AzureRmStorageAccount."
"Cmdlet Output Validator","Microsoft.Azure.Commands.Management.Storage","Set-AzureRmStorageAccount","1","Missing output format for cmdlet output type Microsoft.Azure.Management.Storage.Models.StorageAccount","Add an output format for type Microsoft.Azure.Management.Storage.Models.StorageAccount in Microsoft.Azure.Commands.Management.Storage.format.ps1xml, or verify the default output display is correct."
"Cmdlet Output Validator","Microsoft.Azure.Commands.Management.Storage","Set-AzureRmStorageAccount","0","The output type Microsoft.Azure.Management.Storage.Models.StorageAccount for cmdlet Set-AzureRmStorageAccount uses custom JSON serialization, which will make scripting difficult and break piping scenarios","Add a new display type for cmdlet output (for example PSStorageAccount), then add an output format for the new type in Microsoft.Azure.Commands.Management.Storage.format.ps1xml"
"Cmdlet Output Validator","Microsoft.Azure.Commands.Management.Storage","Set-AzureRmStorageAccount","3","The output type Microsoft.Azure.Management.Storage.Models.StorageAccount for cmdlet Set-AzureRmStorageAccount has properties that are complex types, this may result in unexpected siaply output.","Verify cmdlet output for Set-AzureRmStorageAccount"
"Cmdlet Output Validator","Microsoft.Azure.Commands.Management.Storage","Get-AzureRmStorageAccountNameAvailability","1","Missing output format for cmdlet output type Microsoft.Azure.Management.Storage.Models.CheckNameAvailabilityResult","Add an output format for type Microsoft.Azure.Management.Storage.Models.CheckNameAvailabilityResult in Microsoft.Azure.Commands.Management.Storage.format.ps1xml, or verify the default output display is correct."
"Cmdlet Output Validator","Microsoft.Azure.Commands.Management.Storage","Get-AzureRmStorageAccountNameAvailability","3","The output type Microsoft.Azure.Management.Storage.Models.CheckNameAvailabilityResult for cmdlet Get-AzureRmStorageAccountNameAvailability has properties that are complex types, this may result in unexpected siaply output.","Verify cmdlet output for Get-AzureRmStorageAccountNameAvailability"
"Cmdlet Output Validator","Microsoft.Azure.Commands.Management.Storage","Get-AzureRmStorageUsage","1","Missing output format for cmdlet output type Microsoft.Azure.Commands.Management.Storage.Models.PSUsage","Add an output format for type Microsoft.Azure.Commands.Management.Storage.Models.PSUsage in Microsoft.Azure.Commands.Management.Storage.format.ps1xml, or verify the default output display is correct."
"Cmdlet Output Validator","Microsoft.Azure.Commands.Management.Storage","Get-AzureRmStorageUsage","3","The output type Microsoft.Azure.Commands.Management.Storage.Models.PSUsage for cmdlet Get-AzureRmStorageUsage has properties that are complex types, this may result in unexpected siaply output.","Verify cmdlet output for Get-AzureRmStorageUsage"
"Cmdlet Output Validator","Microsoft.Azure.Commands.Profile","Add-AzureRmAccount","3","The output type Microsoft.Azure.Commands.Models.PSAzureProfile for cmdlet Add-AzureRmAccount has properties that are complex types, this may result in unexpected siaply output.","Verify cmdlet output for Add-AzureRmAccount"
"Cmdlet Output Validator","Microsoft.Azure.Commands.Profile","Get-AzureRmContext","3","The output type Microsoft.Azure.Commands.Models.PSAzureContext for cmdlet Get-AzureRmContext has properties that are complex types, this may result in unexpected siaply output.","Verify cmdlet output for Get-AzureRmContext"
"Cmdlet Output Validator","Microsoft.Azure.Commands.Profile","Set-AzureRmContext","3","The output type Microsoft.Azure.Commands.Models.PSAzureContext for cmdlet Set-AzureRmContext has properties that are complex types, this may result in unexpected siaply output.","Verify cmdlet output for Set-AzureRmContext"
"Cmdlet Output Validator","Microsoft.Azure.Commands.Profile","Add-AzureRmEnvironment","3","The output type Microsoft.Azure.Commands.Models.PSAzureEnvironment for cmdlet Add-AzureRmEnvironment has properties that are complex types, this may result in unexpected siaply output.","Verify cmdlet output for Add-AzureRmEnvironment"
"Cmdlet Output Validator","Microsoft.Azure.Commands.Profile","Get-AzureRmEnvironment","3","The output type Microsoft.Azure.Commands.Models.PSAzureEnvironment for cmdlet Get-AzureRmEnvironment has properties that are complex types, this may result in unexpected siaply output.","Verify cmdlet output for Get-AzureRmEnvironment"
"Cmdlet Output Validator","Microsoft.Azure.Commands.Profile","Remove-AzureRmEnvironment","3","The output type Microsoft.Azure.Commands.Models.PSAzureEnvironment for cmdlet Remove-AzureRmEnvironment has properties that are complex types, this may result in unexpected siaply output.","Verify cmdlet output for Remove-AzureRmEnvironment"
"Cmdlet Output Validator","Microsoft.Azure.Commands.Profile","Set-AzureRmEnvironment","3","The output type Microsoft.Azure.Commands.Models.PSAzureEnvironment for cmdlet Set-AzureRmEnvironment has properties that are complex types, this may result in unexpected siaply output.","Verify cmdlet output for Set-AzureRmEnvironment"
"Cmdlet Output Validator","Microsoft.Azure.Commands.Profile","Save-AzureRmProfile","3","The output type Microsoft.Azure.Commands.Models.PSAzureProfile for cmdlet Save-AzureRmProfile has properties that are complex types, this may result in unexpected siaply output.","Verify cmdlet output for Save-AzureRmProfile"
"Cmdlet Output Validator","Microsoft.Azure.Commands.Profile","Select-AzureRmProfile","3","The output type Microsoft.Azure.Commands.Models.PSAzureProfile for cmdlet Select-AzureRmProfile has properties that are complex types, this may result in unexpected siaply output.","Verify cmdlet output for Select-AzureRmProfile"
"Cmdlet Output Validator","Microsoft.Azure.Commands.Profile","Get-AzureRmSubscription","3","The output type Microsoft.Azure.Commands.Models.PSAzureSubscription for cmdlet Get-AzureRmSubscription has properties that are complex types, this may result in unexpected siaply output.","Verify cmdlet output for Get-AzureRmSubscription"
"Cmdlet Output Validator","Microsoft.Azure.Commands.Profile","Get-AzureRmTenant","3","The output type Microsoft.Azure.Commands.Models.PSAzureTenant for cmdlet Get-AzureRmTenant has properties that are complex types, this may result in unexpected siaply output.","Verify cmdlet output for Get-AzureRmTenant"
"Cmdlet Output Validator","Microsoft.Azure.Commands.Resources","Microsoft.Azure.Commands.Resources.Models.PSResourceProviderType","0","Type 'Microsoft.Azure.Commands.Resources.Models.PSResourceProviderType' contains invalid table column format. ","Replace unsupported format elements in C:\pd\azure-powershell\src\CLU\StaticAnalysis\..\Microsoft.Azure.Commands.Resources\Microsoft.Azure.Commands.Resources.format.ps1xml table control for Microsoft.Azure.Commands.Resources.Models.PSResourceProviderType"
"Cmdlet Output Validator","Microsoft.Azure.Commands.Resources","Microsoft.Azure.Commands.Resources.Models.PSResourceProviderType","0","Type 'Microsoft.Azure.Commands.Resources.Models.PSResourceProviderType' contains invalid table column format. ","Replace unsupported format elements in C:\pd\azure-powershell\src\CLU\StaticAnalysis\..\Microsoft.Azure.Commands.Resources\Microsoft.Azure.Commands.Resources.format.ps1xml table control for Microsoft.Azure.Commands.Resources.Models.PSResourceProviderType"
"Cmdlet Output Validator","Microsoft.Azure.Commands.Resources","Microsoft.Azure.Commands.Resources.Models.PSResourceProviderType","0","Type 'Microsoft.Azure.Commands.Resources.Models.PSResourceProviderType' contains invalid table column format. ","Replace unsupported format elements in C:\pd\azure-powershell\src\CLU\StaticAnalysis\..\Microsoft.Azure.Commands.Resources\Microsoft.Azure.Commands.Resources.format.ps1xml table control for Microsoft.Azure.Commands.Resources.Models.PSResourceProviderType"
"Cmdlet Output Validator","Microsoft.Azure.Commands.Resources","Microsoft.Azure.Commands.Resources.Models.PSResourceProviderType","0","Type 'Microsoft.Azure.Commands.Resources.Models.PSResourceProviderType' contains invalid table column format. ","Replace unsupported format elements in C:\pd\azure-powershell\src\CLU\StaticAnalysis\..\Microsoft.Azure.Commands.Resources\Microsoft.Azure.Commands.Resources.format.ps1xml table control for Microsoft.Azure.Commands.Resources.Models.PSResourceProviderType"
"Cmdlet Output Validator","Microsoft.Azure.Commands.Resources","Microsoft.Azure.Commands.Resources.Models.PSResourceProviderType","0","Type 'Microsoft.Azure.Commands.Resources.Models.PSResourceProviderType' contains invalid table column format. ","Replace unsupported format elements in C:\pd\azure-powershell\src\CLU\StaticAnalysis\..\Microsoft.Azure.Commands.Resources\Microsoft.Azure.Commands.Resources.format.ps1xml table control for Microsoft.Azure.Commands.Resources.Models.PSResourceProviderType"
"Cmdlet Output Validator","Microsoft.Azure.Commands.Resources","Microsoft.Azure.Commands.Resources.Models.PSResourceProviderType","0","Type 'Microsoft.Azure.Commands.Resources.Models.PSResourceProviderType' contains invalid table column format. ","Replace unsupported format elements in C:\pd\azure-powershell\src\CLU\StaticAnalysis\..\Microsoft.Azure.Commands.Resources\Microsoft.Azure.Commands.Resources.format.ps1xml table control for Microsoft.Azure.Commands.Resources.Models.PSResourceProviderType"
"Cmdlet Output Validator","Microsoft.Azure.Commands.Resources","Get-AzureRmTag","1","Missing output format for cmdlet output type Microsoft.Azure.Commands.ResourceManager.Cmdlets.Tags.PSTag","Add an output format for type Microsoft.Azure.Commands.ResourceManager.Cmdlets.Tags.PSTag in Microsoft.Azure.Commands.Resources.format.ps1xml, or verify the default output display is correct."
"Cmdlet Output Validator","Microsoft.Azure.Commands.Resources","Get-AzureRmTag","3","The output type Microsoft.Azure.Commands.ResourceManager.Cmdlets.Tags.PSTag for cmdlet Get-AzureRmTag has properties that are complex types, this may result in unexpected siaply output.","Verify cmdlet output for Get-AzureRmTag"
"Cmdlet Output Validator","Microsoft.Azure.Commands.Resources","New-AzureRmTag","1","Missing output format for cmdlet output type Microsoft.Azure.Commands.ResourceManager.Cmdlets.Tags.PSTag","Add an output format for type Microsoft.Azure.Commands.ResourceManager.Cmdlets.Tags.PSTag in Microsoft.Azure.Commands.Resources.format.ps1xml, or verify the default output display is correct."
"Cmdlet Output Validator","Microsoft.Azure.Commands.Resources","New-AzureRmTag","3","The output type Microsoft.Azure.Commands.ResourceManager.Cmdlets.Tags.PSTag for cmdlet New-AzureRmTag has properties that are complex types, this may result in unexpected siaply output.","Verify cmdlet output for New-AzureRmTag"
"Cmdlet Output Validator","Microsoft.Azure.Commands.Resources","Remove-AzureRmTag","1","Missing output format for cmdlet output type Microsoft.Azure.Commands.ResourceManager.Cmdlets.Tags.PSTag","Add an output format for type Microsoft.Azure.Commands.ResourceManager.Cmdlets.Tags.PSTag in Microsoft.Azure.Commands.Resources.format.ps1xml, or verify the default output display is correct."
"Cmdlet Output Validator","Microsoft.Azure.Commands.Resources","Remove-AzureRmTag","3","The output type Microsoft.Azure.Commands.ResourceManager.Cmdlets.Tags.PSTag for cmdlet Remove-AzureRmTag has properties that are complex types, this may result in unexpected siaply output.","Verify cmdlet output for Remove-AzureRmTag"
"Cmdlet Output Validator","Microsoft.Azure.Commands.Resources","Get-AzureRmResourceProvider","1","Missing output format for cmdlet output type Microsoft.Azure.Commands.Resources.Models.PSResourceProvider","Add an output format for type Microsoft.Azure.Commands.Resources.Models.PSResourceProvider in Microsoft.Azure.Commands.Resources.format.ps1xml, or verify the default output display is correct."
"Cmdlet Output Validator","Microsoft.Azure.Commands.Resources","Get-AzureRmResourceProvider","3","The output type Microsoft.Azure.Commands.Resources.Models.PSResourceProvider for cmdlet Get-AzureRmResourceProvider has properties that are complex types, this may result in unexpected siaply output.","Verify cmdlet output for Get-AzureRmResourceProvider"
"Cmdlet Output Validator","Microsoft.Azure.Commands.Resources","Get-AzureRmProviderOperation","1","Missing output format for cmdlet output type Microsoft.Azure.Commands.Resources.Models.PSResourceProviderOperation","Add an output format for type Microsoft.Azure.Commands.Resources.Models.PSResourceProviderOperation in Microsoft.Azure.Commands.Resources.format.ps1xml, or verify the default output display is correct."
"Cmdlet Output Validator","Microsoft.Azure.Commands.Resources","Get-AzureRmProviderOperation","3","The output type Microsoft.Azure.Commands.Resources.Models.PSResourceProviderOperation for cmdlet Get-AzureRmProviderOperation has properties that are complex types, this may result in unexpected siaply output.","Verify cmdlet output for Get-AzureRmProviderOperation"
"Cmdlet Output Validator","Microsoft.Azure.Commands.Resources","Register-AzureRmResourceProvider","1","Missing output format for cmdlet output type Microsoft.Azure.Commands.Resources.Models.PSResourceProvider","Add an output format for type Microsoft.Azure.Commands.Resources.Models.PSResourceProvider in Microsoft.Azure.Commands.Resources.format.ps1xml, or verify the default output display is correct."
"Cmdlet Output Validator","Microsoft.Azure.Commands.Resources","Register-AzureRmResourceProvider","3","The output type Microsoft.Azure.Commands.Resources.Models.PSResourceProvider for cmdlet Register-AzureRmResourceProvider has properties that are complex types, this may result in unexpected siaply output.","Verify cmdlet output for Register-AzureRmResourceProvider"
"Cmdlet Output Validator","Microsoft.Azure.Commands.Resources","Unregister-AzureRmResourceProvider","1","Missing output format for cmdlet output type Microsoft.Azure.Commands.Resources.Models.PSResourceProvider","Add an output format for type Microsoft.Azure.Commands.Resources.Models.PSResourceProvider in Microsoft.Azure.Commands.Resources.format.ps1xml, or verify the default output display is correct."
"Cmdlet Output Validator","Microsoft.Azure.Commands.Resources","Unregister-AzureRmResourceProvider","3","The output type Microsoft.Azure.Commands.Resources.Models.PSResourceProvider for cmdlet Unregister-AzureRmResourceProvider has properties that are complex types, this may result in unexpected siaply output.","Verify cmdlet output for Unregister-AzureRmResourceProvider"
"Cmdlet Output Validator","Microsoft.Azure.Commands.Resources","Get-AzureRmResourceGroupDeployment","3","The output type Microsoft.Azure.Commands.Resources.Models.PSResourceGroupDeployment for cmdlet Get-AzureRmResourceGroupDeployment has properties that are complex types, this may result in unexpected siaply output.","Verify cmdlet output for Get-AzureRmResourceGroupDeployment"
"Cmdlet Output Validator","Microsoft.Azure.Commands.Resources","New-AzureRmResourceGroupDeployment","3","The output type Microsoft.Azure.Commands.Resources.Models.PSResourceGroupDeployment for cmdlet New-AzureRmResourceGroupDeployment has properties that are complex types, this may result in unexpected siaply output.","Verify cmdlet output for New-AzureRmResourceGroupDeployment"
"Cmdlet Output Validator","Microsoft.Azure.Commands.Resources","Get-AzureRmResourceGroup","3","The output type Microsoft.Azure.Commands.Resources.Models.PSResourceGroup for cmdlet Get-AzureRmResourceGroup has properties that are complex types, this may result in unexpected siaply output.","Verify cmdlet output for Get-AzureRmResourceGroup"
"Cmdlet Output Validator","Microsoft.Azure.Commands.Resources","New-AzureRmResourceGroup","3","The output type Microsoft.Azure.Commands.Resources.Models.PSResourceGroup for cmdlet New-AzureRmResourceGroup has properties that are complex types, this may result in unexpected siaply output.","Verify cmdlet output for New-AzureRmResourceGroup"
"Cmdlet Output Validator","Microsoft.Azure.Commands.Resources","Set-AzureRmResourceGroup","3","The output type Microsoft.Azure.Commands.Resources.Models.PSResourceGroup for cmdlet Set-AzureRmResourceGroup has properties that are complex types, this may result in unexpected siaply output.","Verify cmdlet output for Set-AzureRmResourceGroup"
"Cmdlet Output Validator","Microsoft.Azure.Commands.Resources","Get-AzureRmRoleAssignment","1","Missing output format for cmdlet output type Microsoft.Azure.Commands.Resources.Models.Authorization.PSRoleAssignment","Add an output format for type Microsoft.Azure.Commands.Resources.Models.Authorization.PSRoleAssignment in Microsoft.Azure.Commands.Resources.format.ps1xml, or verify the default output display is correct."
"Cmdlet Output Validator","Microsoft.Azure.Commands.Resources","Get-AzureRmRoleAssignment","3","The output type Microsoft.Azure.Commands.Resources.Models.Authorization.PSRoleAssignment for cmdlet Get-AzureRmRoleAssignment has properties that are complex types, this may result in unexpected siaply output.","Verify cmdlet output for Get-AzureRmRoleAssignment"
"Cmdlet Output Validator","Microsoft.Azure.Commands.Resources","New-AzureRmRoleAssignment","1","Missing output format for cmdlet output type Microsoft.Azure.Commands.Resources.Models.Authorization.PSRoleAssignment","Add an output format for type Microsoft.Azure.Commands.Resources.Models.Authorization.PSRoleAssignment in Microsoft.Azure.Commands.Resources.format.ps1xml, or verify the default output display is correct."
"Cmdlet Output Validator","Microsoft.Azure.Commands.Resources","New-AzureRmRoleAssignment","3","The output type Microsoft.Azure.Commands.Resources.Models.Authorization.PSRoleAssignment for cmdlet New-AzureRmRoleAssignment has properties that are complex types, this may result in unexpected siaply output.","Verify cmdlet output for New-AzureRmRoleAssignment"
"Cmdlet Output Validator","Microsoft.Azure.Commands.Resources","Remove-AzureRmRoleAssignment","1","Missing output format for cmdlet output type Microsoft.Azure.Commands.Resources.Models.Authorization.PSRoleAssignment","Add an output format for type Microsoft.Azure.Commands.Resources.Models.Authorization.PSRoleAssignment in Microsoft.Azure.Commands.Resources.format.ps1xml, or verify the default output display is correct."
"Cmdlet Output Validator","Microsoft.Azure.Commands.Resources","Remove-AzureRmRoleAssignment","3","The output type Microsoft.Azure.Commands.Resources.Models.Authorization.PSRoleAssignment for cmdlet Remove-AzureRmRoleAssignment has properties that are complex types, this may result in unexpected siaply output.","Verify cmdlet output for Remove-AzureRmRoleAssignment"
"Cmdlet Output Validator","Microsoft.Azure.Commands.Resources","Get-AzureRmRoleDefinition","3","The output type Microsoft.Azure.Commands.Resources.Models.Authorization.PSRoleDefinition for cmdlet Get-AzureRmRoleDefinition has properties that are complex types, this may result in unexpected siaply output.","Verify cmdlet output for Get-AzureRmRoleDefinition"
"Cmdlet Output Validator","Microsoft.Azure.Commands.Resources","New-AzureRmRoleDefinition","3","The output type Microsoft.Azure.Commands.Resources.Models.Authorization.PSRoleDefinition for cmdlet New-AzureRmRoleDefinition has properties that are complex types, this may result in unexpected siaply output.","Verify cmdlet output for New-AzureRmRoleDefinition"
"Cmdlet Output Validator","Microsoft.Azure.Commands.Resources","Set-AzureRmRoleDefinition","3","The output type Microsoft.Azure.Commands.Resources.Models.Authorization.PSRoleDefinition for cmdlet Set-AzureRmRoleDefinition has properties that are complex types, this may result in unexpected siaply output.","Verify cmdlet output for Set-AzureRmRoleDefinition"
"Cmdlet Output Validator","Microsoft.Azure.Commands.Resources","Test-AzureRmResourceGroupDeployment","3","The output type Microsoft.Azure.Commands.Resources.Models.PSResourceManagerError for cmdlet Test-AzureRmResourceGroupDeployment has properties that are complex types, this may result in unexpected siaply output.","Verify cmdlet output for Test-AzureRmResourceGroupDeployment"
"Cmdlet Output Validator","Microsoft.Azure.Commands.Resources","Get-AzureRmProviderFeature","1","Missing output format for cmdlet output type Microsoft.Azure.Commands.Resources.Models.ProviderFeatures.PSProviderFeature","Add an output format for type Microsoft.Azure.Commands.Resources.Models.ProviderFeatures.PSProviderFeature in Microsoft.Azure.Commands.Resources.format.ps1xml, or verify the default output display is correct."
"Cmdlet Output Validator","Microsoft.Azure.Commands.Resources","Get-AzureRmProviderFeature","3","The output type Microsoft.Azure.Commands.Resources.Models.ProviderFeatures.PSProviderFeature for cmdlet Get-AzureRmProviderFeature has properties that are complex types, this may result in unexpected siaply output.","Verify cmdlet output for Get-AzureRmProviderFeature"
"Cmdlet Output Validator","Microsoft.Azure.Commands.Resources","Register-AzureRmProviderFeature","1","Missing output format for cmdlet output type Microsoft.Azure.Commands.Resources.Models.ProviderFeatures.PSProviderFeature","Add an output format for type Microsoft.Azure.Commands.Resources.Models.ProviderFeatures.PSProviderFeature in Microsoft.Azure.Commands.Resources.format.ps1xml, or verify the default output display is correct."
"Cmdlet Output Validator","Microsoft.Azure.Commands.Resources","Register-AzureRmProviderFeature","3","The output type Microsoft.Azure.Commands.Resources.Models.ProviderFeatures.PSProviderFeature for cmdlet Register-AzureRmProviderFeature has properties that are complex types, this may result in unexpected siaply output.","Verify cmdlet output for Register-AzureRmProviderFeature"
"Cmdlet Output Validator","Microsoft.Azure.Commands.Resources","Get-AzureRmADGroup","1","Missing output format for cmdlet output type Microsoft.Azure.Commands.Resources.Models.ActiveDirectory.PSADGroup","Add an output format for type Microsoft.Azure.Commands.Resources.Models.ActiveDirectory.PSADGroup in Microsoft.Azure.Commands.Resources.format.ps1xml, or verify the default output display is correct."
"Cmdlet Output Validator","Microsoft.Azure.Commands.Resources","Get-AzureRmADGroup","3","The output type Microsoft.Azure.Commands.Resources.Models.ActiveDirectory.PSADGroup for cmdlet Get-AzureRmADGroup has properties that are complex types, this may result in unexpected siaply output.","Verify cmdlet output for Get-AzureRmADGroup"
"Cmdlet Output Validator","Microsoft.Azure.Commands.Resources","Get-AzureRmADGroupMember","3","The output type Microsoft.Azure.Commands.Resources.Models.ActiveDirectory.PSADObject for cmdlet Get-AzureRmADGroupMember has properties that are complex types, this may result in unexpected siaply output.","Verify cmdlet output for Get-AzureRmADGroupMember"
"Cmdlet Output Validator","Microsoft.Azure.Commands.Resources","Get-AzureRmADServicePrincipal","1","Missing output format for cmdlet output type Microsoft.Azure.Commands.Resources.Models.ActiveDirectory.PSADServicePrincipal","Add an output format for type Microsoft.Azure.Commands.Resources.Models.ActiveDirectory.PSADServicePrincipal in Microsoft.Azure.Commands.Resources.format.ps1xml, or verify the default output display is correct."
"Cmdlet Output Validator","Microsoft.Azure.Commands.Resources","Get-AzureRmADServicePrincipal","3","The output type Microsoft.Azure.Commands.Resources.Models.ActiveDirectory.PSADServicePrincipal for cmdlet Get-AzureRmADServicePrincipal has properties that are complex types, this may result in unexpected siaply output.","Verify cmdlet output for Get-AzureRmADServicePrincipal"
"Cmdlet Output Validator","Microsoft.Azure.Commands.Resources","Get-AzureRmADUser","1","Missing output format for cmdlet output type Microsoft.Azure.Commands.Resources.Models.ActiveDirectory.PSADUser","Add an output format for type Microsoft.Azure.Commands.Resources.Models.ActiveDirectory.PSADUser in Microsoft.Azure.Commands.Resources.format.ps1xml, or verify the default output display is correct."
"Cmdlet Output Validator","Microsoft.Azure.Commands.Resources","Get-AzureRmADUser","3","The output type Microsoft.Azure.Commands.Resources.Models.ActiveDirectory.PSADUser for cmdlet Get-AzureRmADUser has properties that are complex types, this may result in unexpected siaply output.","Verify cmdlet output for Get-AzureRmADUser"
"Cmdlet Output Validator","Microsoft.Azure.Commands.Resources","New-AzureRmADApplication","1","Missing output format for cmdlet output type Microsoft.Azure.Commands.Resources.Models.ActiveDirectory.PSADApplication","Add an output format for type Microsoft.Azure.Commands.Resources.Models.ActiveDirectory.PSADApplication in Microsoft.Azure.Commands.Resources.format.ps1xml, or verify the default output display is correct."
"Cmdlet Output Validator","Microsoft.Azure.Commands.Resources","New-AzureRmADApplication","3","The output type Microsoft.Azure.Commands.Resources.Models.ActiveDirectory.PSADApplication for cmdlet New-AzureRmADApplication has properties that are complex types, this may result in unexpected siaply output.","Verify cmdlet output for New-AzureRmADApplication"
"Cmdlet Output Validator","Microsoft.Azure.Commands.Resources","New-AzureRmADServicePrincipal","1","Missing output format for cmdlet output type Microsoft.Azure.Commands.Resources.Models.ActiveDirectory.PSADServicePrincipal","Add an output format for type Microsoft.Azure.Commands.Resources.Models.ActiveDirectory.PSADServicePrincipal in Microsoft.Azure.Commands.Resources.format.ps1xml, or verify the default output display is correct."
"Cmdlet Output Validator","Microsoft.Azure.Commands.Resources","New-AzureRmADServicePrincipal","3","The output type Microsoft.Azure.Commands.Resources.Models.ActiveDirectory.PSADServicePrincipal for cmdlet New-AzureRmADServicePrincipal has properties that are complex types, this may result in unexpected siaply output.","Verify cmdlet output for New-AzureRmADServicePrincipal"
"Cmdlet Output Validator","Microsoft.Azure.Commands.Resources","Remove-AzureRmADApplication","0","The cmdlet Remove-AzureRmADApplication has no OutputType attribute.  Please add an OutputType attribute for each of the types the cmdlet may output.","Add OutputType attribute for each output type of cmdlet Remove-AzureRmADApplication."
"Cmdlet Output Validator","Microsoft.Azure.Commands.Resources","Remove-AzureRmADServicePrincipal","1","Missing output format for cmdlet output type Microsoft.Azure.Commands.Resources.Models.ActiveDirectory.PSADServicePrincipal","Add an output format for type Microsoft.Azure.Commands.Resources.Models.ActiveDirectory.PSADServicePrincipal in Microsoft.Azure.Commands.Resources.format.ps1xml, or verify the default output display is correct."
"Cmdlet Output Validator","Microsoft.Azure.Commands.Resources","Remove-AzureRmADServicePrincipal","3","The output type Microsoft.Azure.Commands.Resources.Models.ActiveDirectory.PSADServicePrincipal for cmdlet Remove-AzureRmADServicePrincipal has properties that are complex types, this may result in unexpected siaply output.","Verify cmdlet output for Remove-AzureRmADServicePrincipal"
"Cmdlet Output Validator","Microsoft.Azure.Commands.Websites","Get-AzureRMWebAppSlot","3","The output type Microsoft.Azure.Commands.Websites.Models.WebApp.PSSite for cmdlet Get-AzureRMWebAppSlot has properties that are complex types, this may result in unexpected siaply output.","Verify cmdlet output for Get-AzureRMWebAppSlot"
"Cmdlet Output Validator","Microsoft.Azure.Commands.Websites","Get-AzureRMWebAppSlotMetrics","3","The output type Microsoft.Azure.Commands.Websites.Models.WebApp.PSResourceMetric for cmdlet Get-AzureRMWebAppSlotMetrics has properties that are complex types, this may result in unexpected siaply output.","Verify cmdlet output for Get-AzureRMWebAppSlotMetrics"
"Cmdlet Output Validator","Microsoft.Azure.Commands.Websites","New-AzureRMWebAppSlot","3","The output type Microsoft.Azure.Commands.Websites.Models.WebApp.PSSite for cmdlet New-AzureRMWebAppSlot has properties that are complex types, this may result in unexpected siaply output.","Verify cmdlet output for New-AzureRMWebAppSlot"
"Cmdlet Output Validator","Microsoft.Azure.Commands.Websites","Restart-AzureRMWebAppSlot","3","The output type Microsoft.Azure.Commands.Websites.Models.WebApp.PSSite for cmdlet Restart-AzureRMWebAppSlot has properties that are complex types, this may result in unexpected siaply output.","Verify cmdlet output for Restart-AzureRMWebAppSlot"
"Cmdlet Output Validator","Microsoft.Azure.Commands.Websites","Set-AzureRMWebAppSlot","3","The output type Microsoft.Azure.Commands.Websites.Models.WebApp.PSSite for cmdlet Set-AzureRMWebAppSlot has properties that are complex types, this may result in unexpected siaply output.","Verify cmdlet output for Set-AzureRMWebAppSlot"
"Cmdlet Output Validator","Microsoft.Azure.Commands.Websites","Start-AzureRMWebAppSlot","3","The output type Microsoft.Azure.Commands.Websites.Models.WebApp.PSSite for cmdlet Start-AzureRMWebAppSlot has properties that are complex types, this may result in unexpected siaply output.","Verify cmdlet output for Start-AzureRMWebAppSlot"
"Cmdlet Output Validator","Microsoft.Azure.Commands.Websites","Stop-AzureRMWebAppSlot","3","The output type Microsoft.Azure.Commands.Websites.Models.WebApp.PSSite for cmdlet Stop-AzureRMWebAppSlot has properties that are complex types, this may result in unexpected siaply output.","Verify cmdlet output for Stop-AzureRMWebAppSlot"
"Cmdlet Output Validator","Microsoft.Azure.Commands.Websites","Get-AzureRMAppServicePlanMetrics","3","The output type Microsoft.Azure.Commands.Websites.Models.WebApp.PSResourceMetric for cmdlet Get-AzureRMAppServicePlanMetrics has properties that are complex types, this may result in unexpected siaply output.","Verify cmdlet output for Get-AzureRMAppServicePlanMetrics"
"Cmdlet Output Validator","Microsoft.Azure.Commands.Websites","Get-AzureRMWebApp","3","The output type Microsoft.Azure.Commands.Websites.Models.WebApp.PSSite for cmdlet Get-AzureRMWebApp has properties that are complex types, this may result in unexpected siaply output.","Verify cmdlet output for Get-AzureRMWebApp"
"Cmdlet Output Validator","Microsoft.Azure.Commands.Websites","Get-AzureRMWebAppMetrics","3","The output type Microsoft.Azure.Commands.Websites.Models.WebApp.PSResourceMetric for cmdlet Get-AzureRMWebAppMetrics has properties that are complex types, this may result in unexpected siaply output.","Verify cmdlet output for Get-AzureRMWebAppMetrics"
"Cmdlet Output Validator","Microsoft.Azure.Commands.Websites","New-AzureRmWebApp","3","The output type Microsoft.Azure.Commands.Websites.Models.WebApp.PSSite for cmdlet New-AzureRmWebApp has properties that are complex types, this may result in unexpected siaply output.","Verify cmdlet output for New-AzureRmWebApp"
"Cmdlet Output Validator","Microsoft.Azure.Commands.Websites","Restart-AzureRmWebApp","3","The output type Microsoft.Azure.Commands.Websites.Models.WebApp.PSSite for cmdlet Restart-AzureRmWebApp has properties that are complex types, this may result in unexpected siaply output.","Verify cmdlet output for Restart-AzureRmWebApp"
"Cmdlet Output Validator","Microsoft.Azure.Commands.Websites","Set-AzureRMWebApp","3","The output type Microsoft.Azure.Commands.Websites.Models.WebApp.PSSite for cmdlet Set-AzureRMWebApp has properties that are complex types, this may result in unexpected siaply output.","Verify cmdlet output for Set-AzureRMWebApp"
"Cmdlet Output Validator","Microsoft.Azure.Commands.Websites","Start-AzureRmWebApp","3","The output type Microsoft.Azure.Commands.Websites.Models.WebApp.PSSite for cmdlet Start-AzureRmWebApp has properties that are complex types, this may result in unexpected siaply output.","Verify cmdlet output for Start-AzureRmWebApp"
"Cmdlet Output Validator","Microsoft.Azure.Commands.Websites","Stop-AzureRmWebApp","3","The output type Microsoft.Azure.Commands.Websites.Models.WebApp.PSSite for cmdlet Stop-AzureRmWebApp has properties that are complex types, this may result in unexpected siaply output.","Verify cmdlet output for Stop-AzureRmWebApp"
"Cmdlet Output Validator","Microsoft.Azure.Commands.Websites","Get-AzureRMAppServicePlan","3","The output type Microsoft.Azure.Commands.Websites.Models.WebApp.PSServerFarmWithRichSku for cmdlet Get-AzureRMAppServicePlan has properties that are complex types, this may result in unexpected siaply output.","Verify cmdlet output for Get-AzureRMAppServicePlan"
"Cmdlet Output Validator","Microsoft.Azure.Commands.Websites","New-AzureRMAppServicePlan","3","The output type Microsoft.Azure.Commands.Websites.Models.WebApp.PSServerFarmWithRichSku for cmdlet New-AzureRMAppServicePlan has properties that are complex types, this may result in unexpected siaply output.","Verify cmdlet output for New-AzureRMAppServicePlan"
"Cmdlet Output Validator","Microsoft.Azure.Commands.Websites","Set-AzureRMAppServicePlan","3","The output type Microsoft.Azure.Commands.Websites.Models.WebApp.PSServerFarmWithRichSku for cmdlet Set-AzureRMAppServicePlan has properties that are complex types, this may result in unexpected siaply output.","Verify cmdlet output for Set-AzureRMAppServicePlan"
"CLU Alias Validator","Microsoft.Azure.Commands.Websites","Microsoft.Azure.Commands.WebApps.Cmdlets.AppServicePlans.SetAzureAppServicePlanCmdlet","0","Missing CLI Command Alias Attribute","Add a CliCommand Alias attribute to cmdlet Microsoft.Azure.Commands.WebApps.Cmdlets.AppServicePlans.SetAzureAppServicePlanCmdlet"
"Cmdlet Output Validator","Microsoft.Azure.Commands.Network","Get-AzureRmApplicationGateway","1","Missing output format for cmdlet output type Microsoft.Azure.Commands.Network.Models.PSApplicationGateway","Add an output format for type Microsoft.Azure.Commands.Network.Models.PSApplicationGateway in Microsoft.Azure.Commands.Network.format.ps1xml, or verify the default output display is correct."
"Cmdlet Output Validator","Microsoft.Azure.Commands.Network","Get-AzureRmApplicationGateway","3","The output type Microsoft.Azure.Commands.Network.Models.PSApplicationGateway for cmdlet Get-AzureRmApplicationGateway has properties that are complex types, this may result in unexpected siaply output.","Verify cmdlet output for Get-AzureRmApplicationGateway"
"Cmdlet Output Validator","Microsoft.Azure.Commands.Network","New-AzureRmApplicationGateway","1","Missing output format for cmdlet output type Microsoft.Azure.Commands.Network.Models.PSApplicationGateway","Add an output format for type Microsoft.Azure.Commands.Network.Models.PSApplicationGateway in Microsoft.Azure.Commands.Network.format.ps1xml, or verify the default output display is correct."
"Cmdlet Output Validator","Microsoft.Azure.Commands.Network","New-AzureRmApplicationGateway","3","The output type Microsoft.Azure.Commands.Network.Models.PSApplicationGateway for cmdlet New-AzureRmApplicationGateway has properties that are complex types, this may result in unexpected siaply output.","Verify cmdlet output for New-AzureRmApplicationGateway"
"Cmdlet Output Validator","Microsoft.Azure.Commands.Network","Remove-AzureRmApplicationGateway","0","The cmdlet Remove-AzureRmApplicationGateway has no OutputType attribute.  Please add an OutputType attribute for each of the types the cmdlet may output.","Add OutputType attribute for each output type of cmdlet Remove-AzureRmApplicationGateway."
"Cmdlet Output Validator","Microsoft.Azure.Commands.Network","Set-AzureRmApplicationGateway","1","Missing output format for cmdlet output type Microsoft.Azure.Commands.Network.Models.PSApplicationGateway","Add an output format for type Microsoft.Azure.Commands.Network.Models.PSApplicationGateway in Microsoft.Azure.Commands.Network.format.ps1xml, or verify the default output display is correct."
"Cmdlet Output Validator","Microsoft.Azure.Commands.Network","Set-AzureRmApplicationGateway","3","The output type Microsoft.Azure.Commands.Network.Models.PSApplicationGateway for cmdlet Set-AzureRmApplicationGateway has properties that are complex types, this may result in unexpected siaply output.","Verify cmdlet output for Set-AzureRmApplicationGateway"
"Cmdlet Output Validator","Microsoft.Azure.Commands.Network","Start-AzureRmApplicationGateway","1","Missing output format for cmdlet output type Microsoft.Azure.Commands.Network.Models.PSApplicationGateway","Add an output format for type Microsoft.Azure.Commands.Network.Models.PSApplicationGateway in Microsoft.Azure.Commands.Network.format.ps1xml, or verify the default output display is correct."
"Cmdlet Output Validator","Microsoft.Azure.Commands.Network","Start-AzureRmApplicationGateway","3","The output type Microsoft.Azure.Commands.Network.Models.PSApplicationGateway for cmdlet Start-AzureRmApplicationGateway has properties that are complex types, this may result in unexpected siaply output.","Verify cmdlet output for Start-AzureRmApplicationGateway"
"Cmdlet Output Validator","Microsoft.Azure.Commands.Network","Stop-AzureRmApplicationGateway","1","Missing output format for cmdlet output type Microsoft.Azure.Commands.Network.Models.PSApplicationGateway","Add an output format for type Microsoft.Azure.Commands.Network.Models.PSApplicationGateway in Microsoft.Azure.Commands.Network.format.ps1xml, or verify the default output display is correct."
"Cmdlet Output Validator","Microsoft.Azure.Commands.Network","Stop-AzureRmApplicationGateway","3","The output type Microsoft.Azure.Commands.Network.Models.PSApplicationGateway for cmdlet Stop-AzureRmApplicationGateway has properties that are complex types, this may result in unexpected siaply output.","Verify cmdlet output for Stop-AzureRmApplicationGateway"
"Cmdlet Output Validator","Microsoft.Azure.Commands.Network","Add-AzureRmApplicationGatewayBackendAddressPool","1","Missing output format for cmdlet output type Microsoft.Azure.Commands.Network.Models.PSApplicationGateway","Add an output format for type Microsoft.Azure.Commands.Network.Models.PSApplicationGateway in Microsoft.Azure.Commands.Network.format.ps1xml, or verify the default output display is correct."
"Cmdlet Output Validator","Microsoft.Azure.Commands.Network","Add-AzureRmApplicationGatewayBackendAddressPool","3","The output type Microsoft.Azure.Commands.Network.Models.PSApplicationGateway for cmdlet Add-AzureRmApplicationGatewayBackendAddressPool has properties that are complex types, this may result in unexpected siaply output.","Verify cmdlet output for Add-AzureRmApplicationGatewayBackendAddressPool"
"Cmdlet Output Validator","Microsoft.Azure.Commands.Network","Get-AzureRmApplicationGatewayBackendAddressPool","1","Missing output format for cmdlet output type Microsoft.Azure.Commands.Network.Models.PSApplicationGatewayBackendAddressPool","Add an output format for type Microsoft.Azure.Commands.Network.Models.PSApplicationGatewayBackendAddressPool in Microsoft.Azure.Commands.Network.format.ps1xml, or verify the default output display is correct."
"Cmdlet Output Validator","Microsoft.Azure.Commands.Network","Get-AzureRmApplicationGatewayBackendAddressPool","3","The output type Microsoft.Azure.Commands.Network.Models.PSApplicationGatewayBackendAddressPool for cmdlet Get-AzureRmApplicationGatewayBackendAddressPool has properties that are complex types, this may result in unexpected siaply output.","Verify cmdlet output for Get-AzureRmApplicationGatewayBackendAddressPool"
"Cmdlet Output Validator","Microsoft.Azure.Commands.Network","New-AzureRmApplicationGatewayBackendAddressPool","1","Missing output format for cmdlet output type Microsoft.Azure.Commands.Network.Models.PSApplicationGatewayBackendAddressPool","Add an output format for type Microsoft.Azure.Commands.Network.Models.PSApplicationGatewayBackendAddressPool in Microsoft.Azure.Commands.Network.format.ps1xml, or verify the default output display is correct."
"Cmdlet Output Validator","Microsoft.Azure.Commands.Network","New-AzureRmApplicationGatewayBackendAddressPool","3","The output type Microsoft.Azure.Commands.Network.Models.PSApplicationGatewayBackendAddressPool for cmdlet New-AzureRmApplicationGatewayBackendAddressPool has properties that are complex types, this may result in unexpected siaply output.","Verify cmdlet output for New-AzureRmApplicationGatewayBackendAddressPool"
"Cmdlet Output Validator","Microsoft.Azure.Commands.Network","Remove-AzureRmApplicationGatewayBackendAddressPool","1","Missing output format for cmdlet output type Microsoft.Azure.Commands.Network.Models.PSApplicationGatewayBackendAddressPool","Add an output format for type Microsoft.Azure.Commands.Network.Models.PSApplicationGatewayBackendAddressPool in Microsoft.Azure.Commands.Network.format.ps1xml, or verify the default output display is correct."
"Cmdlet Output Validator","Microsoft.Azure.Commands.Network","Remove-AzureRmApplicationGatewayBackendAddressPool","3","The output type Microsoft.Azure.Commands.Network.Models.PSApplicationGatewayBackendAddressPool for cmdlet Remove-AzureRmApplicationGatewayBackendAddressPool has properties that are complex types, this may result in unexpected siaply output.","Verify cmdlet output for Remove-AzureRmApplicationGatewayBackendAddressPool"
"Cmdlet Output Validator","Microsoft.Azure.Commands.Network","Set-AzureRmApplicationGatewayBackendAddressPool","1","Missing output format for cmdlet output type Microsoft.Azure.Commands.Network.Models.PSApplicationGateway","Add an output format for type Microsoft.Azure.Commands.Network.Models.PSApplicationGateway in Microsoft.Azure.Commands.Network.format.ps1xml, or verify the default output display is correct."
"Cmdlet Output Validator","Microsoft.Azure.Commands.Network","Set-AzureRmApplicationGatewayBackendAddressPool","3","The output type Microsoft.Azure.Commands.Network.Models.PSApplicationGateway for cmdlet Set-AzureRmApplicationGatewayBackendAddressPool has properties that are complex types, this may result in unexpected siaply output.","Verify cmdlet output for Set-AzureRmApplicationGatewayBackendAddressPool"
"Cmdlet Output Validator","Microsoft.Azure.Commands.Network","Add-AzureRmApplicationGatewayBackendHttpSettings","1","Missing output format for cmdlet output type Microsoft.Azure.Commands.Network.Models.PSApplicationGateway","Add an output format for type Microsoft.Azure.Commands.Network.Models.PSApplicationGateway in Microsoft.Azure.Commands.Network.format.ps1xml, or verify the default output display is correct."
"Cmdlet Output Validator","Microsoft.Azure.Commands.Network","Add-AzureRmApplicationGatewayBackendHttpSettings","3","The output type Microsoft.Azure.Commands.Network.Models.PSApplicationGateway for cmdlet Add-AzureRmApplicationGatewayBackendHttpSettings has properties that are complex types, this may result in unexpected siaply output.","Verify cmdlet output for Add-AzureRmApplicationGatewayBackendHttpSettings"
"Cmdlet Output Validator","Microsoft.Azure.Commands.Network","Get-AzureRmApplicationGatewayBackendHttpSettings","1","Missing output format for cmdlet output type Microsoft.Azure.Commands.Network.Models.PSApplicationGatewayBackendHttpSettings","Add an output format for type Microsoft.Azure.Commands.Network.Models.PSApplicationGatewayBackendHttpSettings in Microsoft.Azure.Commands.Network.format.ps1xml, or verify the default output display is correct."
"Cmdlet Output Validator","Microsoft.Azure.Commands.Network","Get-AzureRmApplicationGatewayBackendHttpSettings","3","The output type Microsoft.Azure.Commands.Network.Models.PSApplicationGatewayBackendHttpSettings for cmdlet Get-AzureRmApplicationGatewayBackendHttpSettings has properties that are complex types, this may result in unexpected siaply output.","Verify cmdlet output for Get-AzureRmApplicationGatewayBackendHttpSettings"
"Cmdlet Output Validator","Microsoft.Azure.Commands.Network","New-AzureRmApplicationGatewayBackendHttpSettings","1","Missing output format for cmdlet output type Microsoft.Azure.Commands.Network.Models.PSApplicationGatewayBackendHttpSettings","Add an output format for type Microsoft.Azure.Commands.Network.Models.PSApplicationGatewayBackendHttpSettings in Microsoft.Azure.Commands.Network.format.ps1xml, or verify the default output display is correct."
"Cmdlet Output Validator","Microsoft.Azure.Commands.Network","New-AzureRmApplicationGatewayBackendHttpSettings","3","The output type Microsoft.Azure.Commands.Network.Models.PSApplicationGatewayBackendHttpSettings for cmdlet New-AzureRmApplicationGatewayBackendHttpSettings has properties that are complex types, this may result in unexpected siaply output.","Verify cmdlet output for New-AzureRmApplicationGatewayBackendHttpSettings"
"Cmdlet Output Validator","Microsoft.Azure.Commands.Network","Remove-AzureRmApplicationGatewayBackendHttpSettings","1","Missing output format for cmdlet output type Microsoft.Azure.Commands.Network.Models.PSApplicationGateway","Add an output format for type Microsoft.Azure.Commands.Network.Models.PSApplicationGateway in Microsoft.Azure.Commands.Network.format.ps1xml, or verify the default output display is correct."
"Cmdlet Output Validator","Microsoft.Azure.Commands.Network","Remove-AzureRmApplicationGatewayBackendHttpSettings","3","The output type Microsoft.Azure.Commands.Network.Models.PSApplicationGateway for cmdlet Remove-AzureRmApplicationGatewayBackendHttpSettings has properties that are complex types, this may result in unexpected siaply output.","Verify cmdlet output for Remove-AzureRmApplicationGatewayBackendHttpSettings"
"Cmdlet Output Validator","Microsoft.Azure.Commands.Network","Set-AzureRmApplicationGatewayBackendHttpSettings","1","Missing output format for cmdlet output type Microsoft.Azure.Commands.Network.Models.PSApplicationGateway","Add an output format for type Microsoft.Azure.Commands.Network.Models.PSApplicationGateway in Microsoft.Azure.Commands.Network.format.ps1xml, or verify the default output display is correct."
"Cmdlet Output Validator","Microsoft.Azure.Commands.Network","Set-AzureRmApplicationGatewayBackendHttpSettings","3","The output type Microsoft.Azure.Commands.Network.Models.PSApplicationGateway for cmdlet Set-AzureRmApplicationGatewayBackendHttpSettings has properties that are complex types, this may result in unexpected siaply output.","Verify cmdlet output for Set-AzureRmApplicationGatewayBackendHttpSettings"
"Cmdlet Output Validator","Microsoft.Azure.Commands.Network","Add-AzureRmApplicationGatewayFrontendIPConfig","1","Missing output format for cmdlet output type Microsoft.Azure.Commands.Network.Models.PSApplicationGateway","Add an output format for type Microsoft.Azure.Commands.Network.Models.PSApplicationGateway in Microsoft.Azure.Commands.Network.format.ps1xml, or verify the default output display is correct."
"Cmdlet Output Validator","Microsoft.Azure.Commands.Network","Add-AzureRmApplicationGatewayFrontendIPConfig","3","The output type Microsoft.Azure.Commands.Network.Models.PSApplicationGateway for cmdlet Add-AzureRmApplicationGatewayFrontendIPConfig has properties that are complex types, this may result in unexpected siaply output.","Verify cmdlet output for Add-AzureRmApplicationGatewayFrontendIPConfig"
"Cmdlet Output Validator","Microsoft.Azure.Commands.Network","Get-AzureRmApplicationGatewayFrontendIPConfig","1","Missing output format for cmdlet output type Microsoft.Azure.Commands.Network.Models.PSApplicationGatewayFrontendIPConfiguration","Add an output format for type Microsoft.Azure.Commands.Network.Models.PSApplicationGatewayFrontendIPConfiguration in Microsoft.Azure.Commands.Network.format.ps1xml, or verify the default output display is correct."
"Cmdlet Output Validator","Microsoft.Azure.Commands.Network","Get-AzureRmApplicationGatewayFrontendIPConfig","3","The output type Microsoft.Azure.Commands.Network.Models.PSApplicationGatewayFrontendIPConfiguration for cmdlet Get-AzureRmApplicationGatewayFrontendIPConfig has properties that are complex types, this may result in unexpected siaply output.","Verify cmdlet output for Get-AzureRmApplicationGatewayFrontendIPConfig"
"Cmdlet Output Validator","Microsoft.Azure.Commands.Network","New-AzureRmApplicationGatewayFrontendIPConfig","1","Missing output format for cmdlet output type Microsoft.Azure.Commands.Network.Models.PSApplicationGatewayFrontendIPConfiguration","Add an output format for type Microsoft.Azure.Commands.Network.Models.PSApplicationGatewayFrontendIPConfiguration in Microsoft.Azure.Commands.Network.format.ps1xml, or verify the default output display is correct."
"Cmdlet Output Validator","Microsoft.Azure.Commands.Network","New-AzureRmApplicationGatewayFrontendIPConfig","3","The output type Microsoft.Azure.Commands.Network.Models.PSApplicationGatewayFrontendIPConfiguration for cmdlet New-AzureRmApplicationGatewayFrontendIPConfig has properties that are complex types, this may result in unexpected siaply output.","Verify cmdlet output for New-AzureRmApplicationGatewayFrontendIPConfig"
"Cmdlet Output Validator","Microsoft.Azure.Commands.Network","Remove-AzureRmApplicationGatewayFrontendIPConfig","1","Missing output format for cmdlet output type Microsoft.Azure.Commands.Network.Models.PSApplicationGateway","Add an output format for type Microsoft.Azure.Commands.Network.Models.PSApplicationGateway in Microsoft.Azure.Commands.Network.format.ps1xml, or verify the default output display is correct."
"Cmdlet Output Validator","Microsoft.Azure.Commands.Network","Remove-AzureRmApplicationGatewayFrontendIPConfig","3","The output type Microsoft.Azure.Commands.Network.Models.PSApplicationGateway for cmdlet Remove-AzureRmApplicationGatewayFrontendIPConfig has properties that are complex types, this may result in unexpected siaply output.","Verify cmdlet output for Remove-AzureRmApplicationGatewayFrontendIPConfig"
"Cmdlet Output Validator","Microsoft.Azure.Commands.Network","Set-AzureRmApplicationGatewayFrontendIPConfig","1","Missing output format for cmdlet output type Microsoft.Azure.Commands.Network.Models.PSApplicationGateway","Add an output format for type Microsoft.Azure.Commands.Network.Models.PSApplicationGateway in Microsoft.Azure.Commands.Network.format.ps1xml, or verify the default output display is correct."
"Cmdlet Output Validator","Microsoft.Azure.Commands.Network","Set-AzureRmApplicationGatewayFrontendIPConfig","3","The output type Microsoft.Azure.Commands.Network.Models.PSApplicationGateway for cmdlet Set-AzureRmApplicationGatewayFrontendIPConfig has properties that are complex types, this may result in unexpected siaply output.","Verify cmdlet output for Set-AzureRmApplicationGatewayFrontendIPConfig"
"Cmdlet Output Validator","Microsoft.Azure.Commands.Network","Add-AzureRmApplicationGatewayFrontendPort","1","Missing output format for cmdlet output type Microsoft.Azure.Commands.Network.Models.PSApplicationGateway","Add an output format for type Microsoft.Azure.Commands.Network.Models.PSApplicationGateway in Microsoft.Azure.Commands.Network.format.ps1xml, or verify the default output display is correct."
"Cmdlet Output Validator","Microsoft.Azure.Commands.Network","Add-AzureRmApplicationGatewayFrontendPort","3","The output type Microsoft.Azure.Commands.Network.Models.PSApplicationGateway for cmdlet Add-AzureRmApplicationGatewayFrontendPort has properties that are complex types, this may result in unexpected siaply output.","Verify cmdlet output for Add-AzureRmApplicationGatewayFrontendPort"
"Cmdlet Output Validator","Microsoft.Azure.Commands.Network","Get-AzureRmApplicationGatewayFrontendPort","1","Missing output format for cmdlet output type Microsoft.Azure.Commands.Network.Models.PSApplicationGatewayFrontendPort","Add an output format for type Microsoft.Azure.Commands.Network.Models.PSApplicationGatewayFrontendPort in Microsoft.Azure.Commands.Network.format.ps1xml, or verify the default output display is correct."
"Cmdlet Output Validator","Microsoft.Azure.Commands.Network","Get-AzureRmApplicationGatewayFrontendPort","3","The output type Microsoft.Azure.Commands.Network.Models.PSApplicationGatewayFrontendPort for cmdlet Get-AzureRmApplicationGatewayFrontendPort has properties that are complex types, this may result in unexpected siaply output.","Verify cmdlet output for Get-AzureRmApplicationGatewayFrontendPort"
"Cmdlet Output Validator","Microsoft.Azure.Commands.Network","New-AzureRmApplicationGatewayFrontendPort","1","Missing output format for cmdlet output type Microsoft.Azure.Commands.Network.Models.PSApplicationGatewayFrontendPort","Add an output format for type Microsoft.Azure.Commands.Network.Models.PSApplicationGatewayFrontendPort in Microsoft.Azure.Commands.Network.format.ps1xml, or verify the default output display is correct."
"Cmdlet Output Validator","Microsoft.Azure.Commands.Network","New-AzureRmApplicationGatewayFrontendPort","3","The output type Microsoft.Azure.Commands.Network.Models.PSApplicationGatewayFrontendPort for cmdlet New-AzureRmApplicationGatewayFrontendPort has properties that are complex types, this may result in unexpected siaply output.","Verify cmdlet output for New-AzureRmApplicationGatewayFrontendPort"
"Cmdlet Output Validator","Microsoft.Azure.Commands.Network","Remove-AzureRmApplicationGatewayFrontendPort","1","Missing output format for cmdlet output type Microsoft.Azure.Commands.Network.Models.PSApplicationGateway","Add an output format for type Microsoft.Azure.Commands.Network.Models.PSApplicationGateway in Microsoft.Azure.Commands.Network.format.ps1xml, or verify the default output display is correct."
"Cmdlet Output Validator","Microsoft.Azure.Commands.Network","Remove-AzureRmApplicationGatewayFrontendPort","3","The output type Microsoft.Azure.Commands.Network.Models.PSApplicationGateway for cmdlet Remove-AzureRmApplicationGatewayFrontendPort has properties that are complex types, this may result in unexpected siaply output.","Verify cmdlet output for Remove-AzureRmApplicationGatewayFrontendPort"
"Cmdlet Output Validator","Microsoft.Azure.Commands.Network","Set-AzureRmApplicationGatewayFrontendPort","1","Missing output format for cmdlet output type Microsoft.Azure.Commands.Network.Models.PSApplicationGateway","Add an output format for type Microsoft.Azure.Commands.Network.Models.PSApplicationGateway in Microsoft.Azure.Commands.Network.format.ps1xml, or verify the default output display is correct."
"Cmdlet Output Validator","Microsoft.Azure.Commands.Network","Set-AzureRmApplicationGatewayFrontendPort","3","The output type Microsoft.Azure.Commands.Network.Models.PSApplicationGateway for cmdlet Set-AzureRmApplicationGatewayFrontendPort has properties that are complex types, this may result in unexpected siaply output.","Verify cmdlet output for Set-AzureRmApplicationGatewayFrontendPort"
"Cmdlet Output Validator","Microsoft.Azure.Commands.Network","Add-AzureRmApplicationGatewayIPConfiguration","1","Missing output format for cmdlet output type Microsoft.Azure.Commands.Network.Models.PSApplicationGateway","Add an output format for type Microsoft.Azure.Commands.Network.Models.PSApplicationGateway in Microsoft.Azure.Commands.Network.format.ps1xml, or verify the default output display is correct."
"Cmdlet Output Validator","Microsoft.Azure.Commands.Network","Add-AzureRmApplicationGatewayIPConfiguration","3","The output type Microsoft.Azure.Commands.Network.Models.PSApplicationGateway for cmdlet Add-AzureRmApplicationGatewayIPConfiguration has properties that are complex types, this may result in unexpected siaply output.","Verify cmdlet output for Add-AzureRmApplicationGatewayIPConfiguration"
"Cmdlet Output Validator","Microsoft.Azure.Commands.Network","Get-AzureRmApplicationGatewayIPConfiguration","1","Missing output format for cmdlet output type Microsoft.Azure.Commands.Network.Models.PSApplicationGatewayIPConfiguration","Add an output format for type Microsoft.Azure.Commands.Network.Models.PSApplicationGatewayIPConfiguration in Microsoft.Azure.Commands.Network.format.ps1xml, or verify the default output display is correct."
"Cmdlet Output Validator","Microsoft.Azure.Commands.Network","Get-AzureRmApplicationGatewayIPConfiguration","3","The output type Microsoft.Azure.Commands.Network.Models.PSApplicationGatewayIPConfiguration for cmdlet Get-AzureRmApplicationGatewayIPConfiguration has properties that are complex types, this may result in unexpected siaply output.","Verify cmdlet output for Get-AzureRmApplicationGatewayIPConfiguration"
"Cmdlet Output Validator","Microsoft.Azure.Commands.Network","New-AzureRmApplicationGatewayIPConfiguration","1","Missing output format for cmdlet output type Microsoft.Azure.Commands.Network.Models.PSApplicationGatewayIPConfiguration","Add an output format for type Microsoft.Azure.Commands.Network.Models.PSApplicationGatewayIPConfiguration in Microsoft.Azure.Commands.Network.format.ps1xml, or verify the default output display is correct."
"Cmdlet Output Validator","Microsoft.Azure.Commands.Network","New-AzureRmApplicationGatewayIPConfiguration","3","The output type Microsoft.Azure.Commands.Network.Models.PSApplicationGatewayIPConfiguration for cmdlet New-AzureRmApplicationGatewayIPConfiguration has properties that are complex types, this may result in unexpected siaply output.","Verify cmdlet output for New-AzureRmApplicationGatewayIPConfiguration"
"Cmdlet Output Validator","Microsoft.Azure.Commands.Network","Remove-AzureRmApplicationGatewayIPConfiguration","1","Missing output format for cmdlet output type Microsoft.Azure.Commands.Network.Models.PSApplicationGateway","Add an output format for type Microsoft.Azure.Commands.Network.Models.PSApplicationGateway in Microsoft.Azure.Commands.Network.format.ps1xml, or verify the default output display is correct."
"Cmdlet Output Validator","Microsoft.Azure.Commands.Network","Remove-AzureRmApplicationGatewayIPConfiguration","3","The output type Microsoft.Azure.Commands.Network.Models.PSApplicationGateway for cmdlet Remove-AzureRmApplicationGatewayIPConfiguration has properties that are complex types, this may result in unexpected siaply output.","Verify cmdlet output for Remove-AzureRmApplicationGatewayIPConfiguration"
"Cmdlet Output Validator","Microsoft.Azure.Commands.Network","Set-AzureRmApplicationGatewayIPConfiguration","1","Missing output format for cmdlet output type Microsoft.Azure.Commands.Network.Models.PSApplicationGateway","Add an output format for type Microsoft.Azure.Commands.Network.Models.PSApplicationGateway in Microsoft.Azure.Commands.Network.format.ps1xml, or verify the default output display is correct."
"Cmdlet Output Validator","Microsoft.Azure.Commands.Network","Set-AzureRmApplicationGatewayIPConfiguration","3","The output type Microsoft.Azure.Commands.Network.Models.PSApplicationGateway for cmdlet Set-AzureRmApplicationGatewayIPConfiguration has properties that are complex types, this may result in unexpected siaply output.","Verify cmdlet output for Set-AzureRmApplicationGatewayIPConfiguration"
"Cmdlet Output Validator","Microsoft.Azure.Commands.Network","Add-AzureRmApplicationGatewayHttpListener","1","Missing output format for cmdlet output type Microsoft.Azure.Commands.Network.Models.PSApplicationGateway","Add an output format for type Microsoft.Azure.Commands.Network.Models.PSApplicationGateway in Microsoft.Azure.Commands.Network.format.ps1xml, or verify the default output display is correct."
"Cmdlet Output Validator","Microsoft.Azure.Commands.Network","Add-AzureRmApplicationGatewayHttpListener","3","The output type Microsoft.Azure.Commands.Network.Models.PSApplicationGateway for cmdlet Add-AzureRmApplicationGatewayHttpListener has properties that are complex types, this may result in unexpected siaply output.","Verify cmdlet output for Add-AzureRmApplicationGatewayHttpListener"
"Cmdlet Output Validator","Microsoft.Azure.Commands.Network","Get-AzureRmApplicationGatewayHttpListener","1","Missing output format for cmdlet output type Microsoft.Azure.Commands.Network.Models.PSApplicationGatewayHttpListener","Add an output format for type Microsoft.Azure.Commands.Network.Models.PSApplicationGatewayHttpListener in Microsoft.Azure.Commands.Network.format.ps1xml, or verify the default output display is correct."
"Cmdlet Output Validator","Microsoft.Azure.Commands.Network","Get-AzureRmApplicationGatewayHttpListener","3","The output type Microsoft.Azure.Commands.Network.Models.PSApplicationGatewayHttpListener for cmdlet Get-AzureRmApplicationGatewayHttpListener has properties that are complex types, this may result in unexpected siaply output.","Verify cmdlet output for Get-AzureRmApplicationGatewayHttpListener"
"Cmdlet Output Validator","Microsoft.Azure.Commands.Network","New-AzureRmApplicationGatewayHttpListener","1","Missing output format for cmdlet output type Microsoft.Azure.Commands.Network.Models.PSApplicationGatewayHttpListener","Add an output format for type Microsoft.Azure.Commands.Network.Models.PSApplicationGatewayHttpListener in Microsoft.Azure.Commands.Network.format.ps1xml, or verify the default output display is correct."
"Cmdlet Output Validator","Microsoft.Azure.Commands.Network","New-AzureRmApplicationGatewayHttpListener","3","The output type Microsoft.Azure.Commands.Network.Models.PSApplicationGatewayHttpListener for cmdlet New-AzureRmApplicationGatewayHttpListener has properties that are complex types, this may result in unexpected siaply output.","Verify cmdlet output for New-AzureRmApplicationGatewayHttpListener"
"Cmdlet Output Validator","Microsoft.Azure.Commands.Network","Remove-AzureRmApplicationGatewayHttpListener","1","Missing output format for cmdlet output type Microsoft.Azure.Commands.Network.Models.PSApplicationGatewayHttpListener","Add an output format for type Microsoft.Azure.Commands.Network.Models.PSApplicationGatewayHttpListener in Microsoft.Azure.Commands.Network.format.ps1xml, or verify the default output display is correct."
"Cmdlet Output Validator","Microsoft.Azure.Commands.Network","Remove-AzureRmApplicationGatewayHttpListener","3","The output type Microsoft.Azure.Commands.Network.Models.PSApplicationGatewayHttpListener for cmdlet Remove-AzureRmApplicationGatewayHttpListener has properties that are complex types, this may result in unexpected siaply output.","Verify cmdlet output for Remove-AzureRmApplicationGatewayHttpListener"
"Cmdlet Output Validator","Microsoft.Azure.Commands.Network","Set-AzureRmApplicationGatewayHttpListener","1","Missing output format for cmdlet output type Microsoft.Azure.Commands.Network.Models.PSApplicationGateway","Add an output format for type Microsoft.Azure.Commands.Network.Models.PSApplicationGateway in Microsoft.Azure.Commands.Network.format.ps1xml, or verify the default output display is correct."
"Cmdlet Output Validator","Microsoft.Azure.Commands.Network","Set-AzureRmApplicationGatewayHttpListener","3","The output type Microsoft.Azure.Commands.Network.Models.PSApplicationGateway for cmdlet Set-AzureRmApplicationGatewayHttpListener has properties that are complex types, this may result in unexpected siaply output.","Verify cmdlet output for Set-AzureRmApplicationGatewayHttpListener"
"Cmdlet Output Validator","Microsoft.Azure.Commands.Network","New-AzureRmApplicationGatewayPathRuleConfig","1","Missing output format for cmdlet output type Microsoft.Azure.Commands.Network.Models.PSApplicationGatewayPathRule","Add an output format for type Microsoft.Azure.Commands.Network.Models.PSApplicationGatewayPathRule in Microsoft.Azure.Commands.Network.format.ps1xml, or verify the default output display is correct."
"Cmdlet Output Validator","Microsoft.Azure.Commands.Network","New-AzureRmApplicationGatewayPathRuleConfig","3","The output type Microsoft.Azure.Commands.Network.Models.PSApplicationGatewayPathRule for cmdlet New-AzureRmApplicationGatewayPathRuleConfig has properties that are complex types, this may result in unexpected siaply output.","Verify cmdlet output for New-AzureRmApplicationGatewayPathRuleConfig"
"Cmdlet Output Validator","Microsoft.Azure.Commands.Network","Add-AzureRmApplicationGatewayProbeConfig","1","Missing output format for cmdlet output type Microsoft.Azure.Commands.Network.Models.PSApplicationGateway","Add an output format for type Microsoft.Azure.Commands.Network.Models.PSApplicationGateway in Microsoft.Azure.Commands.Network.format.ps1xml, or verify the default output display is correct."
"Cmdlet Output Validator","Microsoft.Azure.Commands.Network","Add-AzureRmApplicationGatewayProbeConfig","3","The output type Microsoft.Azure.Commands.Network.Models.PSApplicationGateway for cmdlet Add-AzureRmApplicationGatewayProbeConfig has properties that are complex types, this may result in unexpected siaply output.","Verify cmdlet output for Add-AzureRmApplicationGatewayProbeConfig"
"Cmdlet Output Validator","Microsoft.Azure.Commands.Network","Get-AzureRmApplicationGatewayProbeConfig","1","Missing output format for cmdlet output type Microsoft.Azure.Commands.Network.Models.PSApplicationGatewayProbe","Add an output format for type Microsoft.Azure.Commands.Network.Models.PSApplicationGatewayProbe in Microsoft.Azure.Commands.Network.format.ps1xml, or verify the default output display is correct."
"Cmdlet Output Validator","Microsoft.Azure.Commands.Network","Get-AzureRmApplicationGatewayProbeConfig","3","The output type Microsoft.Azure.Commands.Network.Models.PSApplicationGatewayProbe for cmdlet Get-AzureRmApplicationGatewayProbeConfig has properties that are complex types, this may result in unexpected siaply output.","Verify cmdlet output for Get-AzureRmApplicationGatewayProbeConfig"
"Cmdlet Output Validator","Microsoft.Azure.Commands.Network","New-AzureRmApplicationGatewayProbeConfig","1","Missing output format for cmdlet output type Microsoft.Azure.Commands.Network.Models.PSApplicationGatewayProbe","Add an output format for type Microsoft.Azure.Commands.Network.Models.PSApplicationGatewayProbe in Microsoft.Azure.Commands.Network.format.ps1xml, or verify the default output display is correct."
"Cmdlet Output Validator","Microsoft.Azure.Commands.Network","New-AzureRmApplicationGatewayProbeConfig","3","The output type Microsoft.Azure.Commands.Network.Models.PSApplicationGatewayProbe for cmdlet New-AzureRmApplicationGatewayProbeConfig has properties that are complex types, this may result in unexpected siaply output.","Verify cmdlet output for New-AzureRmApplicationGatewayProbeConfig"
"Cmdlet Output Validator","Microsoft.Azure.Commands.Network","Remove-AzureRmApplicationGatewayProbeConfig","1","Missing output format for cmdlet output type Microsoft.Azure.Commands.Network.Models.PSApplicationGateway","Add an output format for type Microsoft.Azure.Commands.Network.Models.PSApplicationGateway in Microsoft.Azure.Commands.Network.format.ps1xml, or verify the default output display is correct."
"Cmdlet Output Validator","Microsoft.Azure.Commands.Network","Remove-AzureRmApplicationGatewayProbeConfig","3","The output type Microsoft.Azure.Commands.Network.Models.PSApplicationGateway for cmdlet Remove-AzureRmApplicationGatewayProbeConfig has properties that are complex types, this may result in unexpected siaply output.","Verify cmdlet output for Remove-AzureRmApplicationGatewayProbeConfig"
"Cmdlet Output Validator","Microsoft.Azure.Commands.Network","Set-AzureRmApplicationGatewayProbeConfig","1","Missing output format for cmdlet output type Microsoft.Azure.Commands.Network.Models.PSApplicationGateway","Add an output format for type Microsoft.Azure.Commands.Network.Models.PSApplicationGateway in Microsoft.Azure.Commands.Network.format.ps1xml, or verify the default output display is correct."
"Cmdlet Output Validator","Microsoft.Azure.Commands.Network","Set-AzureRmApplicationGatewayProbeConfig","3","The output type Microsoft.Azure.Commands.Network.Models.PSApplicationGateway for cmdlet Set-AzureRmApplicationGatewayProbeConfig has properties that are complex types, this may result in unexpected siaply output.","Verify cmdlet output for Set-AzureRmApplicationGatewayProbeConfig"
"Cmdlet Output Validator","Microsoft.Azure.Commands.Network","Add-AzureRmApplicationGatewayRequestRoutingRule","1","Missing output format for cmdlet output type Microsoft.Azure.Commands.Network.Models.PSApplicationGateway","Add an output format for type Microsoft.Azure.Commands.Network.Models.PSApplicationGateway in Microsoft.Azure.Commands.Network.format.ps1xml, or verify the default output display is correct."
"Cmdlet Output Validator","Microsoft.Azure.Commands.Network","Add-AzureRmApplicationGatewayRequestRoutingRule","3","The output type Microsoft.Azure.Commands.Network.Models.PSApplicationGateway for cmdlet Add-AzureRmApplicationGatewayRequestRoutingRule has properties that are complex types, this may result in unexpected siaply output.","Verify cmdlet output for Add-AzureRmApplicationGatewayRequestRoutingRule"
"Cmdlet Output Validator","Microsoft.Azure.Commands.Network","Get-AzureRmApplicationGatewayRequestRoutingRule","1","Missing output format for cmdlet output type Microsoft.Azure.Commands.Network.Models.PSApplicationGatewayRequestRoutingRule","Add an output format for type Microsoft.Azure.Commands.Network.Models.PSApplicationGatewayRequestRoutingRule in Microsoft.Azure.Commands.Network.format.ps1xml, or verify the default output display is correct."
"Cmdlet Output Validator","Microsoft.Azure.Commands.Network","Get-AzureRmApplicationGatewayRequestRoutingRule","3","The output type Microsoft.Azure.Commands.Network.Models.PSApplicationGatewayRequestRoutingRule for cmdlet Get-AzureRmApplicationGatewayRequestRoutingRule has properties that are complex types, this may result in unexpected siaply output.","Verify cmdlet output for Get-AzureRmApplicationGatewayRequestRoutingRule"
"Cmdlet Output Validator","Microsoft.Azure.Commands.Network","New-AzureRmApplicationGatewayRequestRoutingRule","1","Missing output format for cmdlet output type Microsoft.Azure.Commands.Network.Models.PSApplicationGatewayRequestRoutingRule","Add an output format for type Microsoft.Azure.Commands.Network.Models.PSApplicationGatewayRequestRoutingRule in Microsoft.Azure.Commands.Network.format.ps1xml, or verify the default output display is correct."
"Cmdlet Output Validator","Microsoft.Azure.Commands.Network","New-AzureRmApplicationGatewayRequestRoutingRule","3","The output type Microsoft.Azure.Commands.Network.Models.PSApplicationGatewayRequestRoutingRule for cmdlet New-AzureRmApplicationGatewayRequestRoutingRule has properties that are complex types, this may result in unexpected siaply output.","Verify cmdlet output for New-AzureRmApplicationGatewayRequestRoutingRule"
"Cmdlet Output Validator","Microsoft.Azure.Commands.Network","Remove-AzureRmApplicationGatewayRequestRoutingRule","1","Missing output format for cmdlet output type Microsoft.Azure.Commands.Network.Models.PSApplicationGatewayRequestRoutingRule","Add an output format for type Microsoft.Azure.Commands.Network.Models.PSApplicationGatewayRequestRoutingRule in Microsoft.Azure.Commands.Network.format.ps1xml, or verify the default output display is correct."
"Cmdlet Output Validator","Microsoft.Azure.Commands.Network","Remove-AzureRmApplicationGatewayRequestRoutingRule","3","The output type Microsoft.Azure.Commands.Network.Models.PSApplicationGatewayRequestRoutingRule for cmdlet Remove-AzureRmApplicationGatewayRequestRoutingRule has properties that are complex types, this may result in unexpected siaply output.","Verify cmdlet output for Remove-AzureRmApplicationGatewayRequestRoutingRule"
"Cmdlet Output Validator","Microsoft.Azure.Commands.Network","Set-AzureRmApplicationGatewayRequestRoutingRule","1","Missing output format for cmdlet output type Microsoft.Azure.Commands.Network.Models.PSApplicationGateway","Add an output format for type Microsoft.Azure.Commands.Network.Models.PSApplicationGateway in Microsoft.Azure.Commands.Network.format.ps1xml, or verify the default output display is correct."
"Cmdlet Output Validator","Microsoft.Azure.Commands.Network","Set-AzureRmApplicationGatewayRequestRoutingRule","3","The output type Microsoft.Azure.Commands.Network.Models.PSApplicationGateway for cmdlet Set-AzureRmApplicationGatewayRequestRoutingRule has properties that are complex types, this may result in unexpected siaply output.","Verify cmdlet output for Set-AzureRmApplicationGatewayRequestRoutingRule"
"Cmdlet Output Validator","Microsoft.Azure.Commands.Network","Get-AzureRmApplicationGatewaySku","1","Missing output format for cmdlet output type Microsoft.Azure.Commands.Network.Models.PSApplicationGatewaySku","Add an output format for type Microsoft.Azure.Commands.Network.Models.PSApplicationGatewaySku in Microsoft.Azure.Commands.Network.format.ps1xml, or verify the default output display is correct."
"Cmdlet Output Validator","Microsoft.Azure.Commands.Network","Get-AzureRmApplicationGatewaySku","3","The output type Microsoft.Azure.Commands.Network.Models.PSApplicationGatewaySku for cmdlet Get-AzureRmApplicationGatewaySku has properties that are complex types, this may result in unexpected siaply output.","Verify cmdlet output for Get-AzureRmApplicationGatewaySku"
"Cmdlet Output Validator","Microsoft.Azure.Commands.Network","New-AzureRmApplicationGatewaySku","1","Missing output format for cmdlet output type Microsoft.Azure.Commands.Network.Models.PSApplicationGatewaySku","Add an output format for type Microsoft.Azure.Commands.Network.Models.PSApplicationGatewaySku in Microsoft.Azure.Commands.Network.format.ps1xml, or verify the default output display is correct."
"Cmdlet Output Validator","Microsoft.Azure.Commands.Network","New-AzureRmApplicationGatewaySku","3","The output type Microsoft.Azure.Commands.Network.Models.PSApplicationGatewaySku for cmdlet New-AzureRmApplicationGatewaySku has properties that are complex types, this may result in unexpected siaply output.","Verify cmdlet output for New-AzureRmApplicationGatewaySku"
"Cmdlet Output Validator","Microsoft.Azure.Commands.Network","Set-AzureRmApplicationGatewaySku","1","Missing output format for cmdlet output type Microsoft.Azure.Commands.Network.Models.PSApplicationGateway","Add an output format for type Microsoft.Azure.Commands.Network.Models.PSApplicationGateway in Microsoft.Azure.Commands.Network.format.ps1xml, or verify the default output display is correct."
"Cmdlet Output Validator","Microsoft.Azure.Commands.Network","Set-AzureRmApplicationGatewaySku","3","The output type Microsoft.Azure.Commands.Network.Models.PSApplicationGateway for cmdlet Set-AzureRmApplicationGatewaySku has properties that are complex types, this may result in unexpected siaply output.","Verify cmdlet output for Set-AzureRmApplicationGatewaySku"
"Cmdlet Output Validator","Microsoft.Azure.Commands.Network","Add-AzureRmApplicationGatewaySslCertificate","1","Missing output format for cmdlet output type Microsoft.Azure.Commands.Network.Models.PSApplicationGateway","Add an output format for type Microsoft.Azure.Commands.Network.Models.PSApplicationGateway in Microsoft.Azure.Commands.Network.format.ps1xml, or verify the default output display is correct."
"Cmdlet Output Validator","Microsoft.Azure.Commands.Network","Add-AzureRmApplicationGatewaySslCertificate","3","The output type Microsoft.Azure.Commands.Network.Models.PSApplicationGateway for cmdlet Add-AzureRmApplicationGatewaySslCertificate has properties that are complex types, this may result in unexpected siaply output.","Verify cmdlet output for Add-AzureRmApplicationGatewaySslCertificate"
"Cmdlet Output Validator","Microsoft.Azure.Commands.Network","Get-AzureRmApplicationGatewaySslCertificate","1","Missing output format for cmdlet output type Microsoft.Azure.Commands.Network.Models.PSApplicationGatewaySslCertificate","Add an output format for type Microsoft.Azure.Commands.Network.Models.PSApplicationGatewaySslCertificate in Microsoft.Azure.Commands.Network.format.ps1xml, or verify the default output display is correct."
"Cmdlet Output Validator","Microsoft.Azure.Commands.Network","Get-AzureRmApplicationGatewaySslCertificate","3","The output type Microsoft.Azure.Commands.Network.Models.PSApplicationGatewaySslCertificate for cmdlet Get-AzureRmApplicationGatewaySslCertificate has properties that are complex types, this may result in unexpected siaply output.","Verify cmdlet output for Get-AzureRmApplicationGatewaySslCertificate"
"Cmdlet Output Validator","Microsoft.Azure.Commands.Network","New-AzureRmApplicationGatewaySslCertificate","1","Missing output format for cmdlet output type Microsoft.Azure.Commands.Network.Models.PSApplicationGatewaySslCertificate","Add an output format for type Microsoft.Azure.Commands.Network.Models.PSApplicationGatewaySslCertificate in Microsoft.Azure.Commands.Network.format.ps1xml, or verify the default output display is correct."
"Cmdlet Output Validator","Microsoft.Azure.Commands.Network","New-AzureRmApplicationGatewaySslCertificate","3","The output type Microsoft.Azure.Commands.Network.Models.PSApplicationGatewaySslCertificate for cmdlet New-AzureRmApplicationGatewaySslCertificate has properties that are complex types, this may result in unexpected siaply output.","Verify cmdlet output for New-AzureRmApplicationGatewaySslCertificate"
"Cmdlet Output Validator","Microsoft.Azure.Commands.Network","Remove-AzureRmApplicationGatewaySslCertificate","1","Missing output format for cmdlet output type Microsoft.Azure.Commands.Network.Models.PSApplicationGateway","Add an output format for type Microsoft.Azure.Commands.Network.Models.PSApplicationGateway in Microsoft.Azure.Commands.Network.format.ps1xml, or verify the default output display is correct."
"Cmdlet Output Validator","Microsoft.Azure.Commands.Network","Remove-AzureRmApplicationGatewaySslCertificate","3","The output type Microsoft.Azure.Commands.Network.Models.PSApplicationGateway for cmdlet Remove-AzureRmApplicationGatewaySslCertificate has properties that are complex types, this may result in unexpected siaply output.","Verify cmdlet output for Remove-AzureRmApplicationGatewaySslCertificate"
"Cmdlet Output Validator","Microsoft.Azure.Commands.Network","Set-AzureRmApplicationGatewaySslCertificate","1","Missing output format for cmdlet output type Microsoft.Azure.Commands.Network.Models.PSApplicationGateway","Add an output format for type Microsoft.Azure.Commands.Network.Models.PSApplicationGateway in Microsoft.Azure.Commands.Network.format.ps1xml, or verify the default output display is correct."
"Cmdlet Output Validator","Microsoft.Azure.Commands.Network","Set-AzureRmApplicationGatewaySslCertificate","3","The output type Microsoft.Azure.Commands.Network.Models.PSApplicationGateway for cmdlet Set-AzureRmApplicationGatewaySslCertificate has properties that are complex types, this may result in unexpected siaply output.","Verify cmdlet output for Set-AzureRmApplicationGatewaySslCertificate"
"Cmdlet Output Validator","Microsoft.Azure.Commands.Network","Add-AzureRmApplicationGatewayUrlPathMapConfig","1","Missing output format for cmdlet output type Microsoft.Azure.Commands.Network.Models.PSApplicationGateway","Add an output format for type Microsoft.Azure.Commands.Network.Models.PSApplicationGateway in Microsoft.Azure.Commands.Network.format.ps1xml, or verify the default output display is correct."
"Cmdlet Output Validator","Microsoft.Azure.Commands.Network","Add-AzureRmApplicationGatewayUrlPathMapConfig","3","The output type Microsoft.Azure.Commands.Network.Models.PSApplicationGateway for cmdlet Add-AzureRmApplicationGatewayUrlPathMapConfig has properties that are complex types, this may result in unexpected siaply output.","Verify cmdlet output for Add-AzureRmApplicationGatewayUrlPathMapConfig"
"Cmdlet Output Validator","Microsoft.Azure.Commands.Network","Get-AzureRmApplicationGatewayUrlPathMapConfig","1","Missing output format for cmdlet output type Microsoft.Azure.Commands.Network.Models.PSApplicationGatewayUrlPathMap","Add an output format for type Microsoft.Azure.Commands.Network.Models.PSApplicationGatewayUrlPathMap in Microsoft.Azure.Commands.Network.format.ps1xml, or verify the default output display is correct."
"Cmdlet Output Validator","Microsoft.Azure.Commands.Network","Get-AzureRmApplicationGatewayUrlPathMapConfig","3","The output type Microsoft.Azure.Commands.Network.Models.PSApplicationGatewayUrlPathMap for cmdlet Get-AzureRmApplicationGatewayUrlPathMapConfig has properties that are complex types, this may result in unexpected siaply output.","Verify cmdlet output for Get-AzureRmApplicationGatewayUrlPathMapConfig"
"Cmdlet Output Validator","Microsoft.Azure.Commands.Network","New-AzureRmApplicationGatewayUrlPathMapConfig","1","Missing output format for cmdlet output type Microsoft.Azure.Commands.Network.Models.PSApplicationGatewayUrlPathMap","Add an output format for type Microsoft.Azure.Commands.Network.Models.PSApplicationGatewayUrlPathMap in Microsoft.Azure.Commands.Network.format.ps1xml, or verify the default output display is correct."
"Cmdlet Output Validator","Microsoft.Azure.Commands.Network","New-AzureRmApplicationGatewayUrlPathMapConfig","3","The output type Microsoft.Azure.Commands.Network.Models.PSApplicationGatewayUrlPathMap for cmdlet New-AzureRmApplicationGatewayUrlPathMapConfig has properties that are complex types, this may result in unexpected siaply output.","Verify cmdlet output for New-AzureRmApplicationGatewayUrlPathMapConfig"
"Cmdlet Output Validator","Microsoft.Azure.Commands.Network","Remove-AzureRmApplicationGatewayUrlPathMapConfig","1","Missing output format for cmdlet output type Microsoft.Azure.Commands.Network.Models.PSApplicationGateway","Add an output format for type Microsoft.Azure.Commands.Network.Models.PSApplicationGateway in Microsoft.Azure.Commands.Network.format.ps1xml, or verify the default output display is correct."
"Cmdlet Output Validator","Microsoft.Azure.Commands.Network","Remove-AzureRmApplicationGatewayUrlPathMapConfig","3","The output type Microsoft.Azure.Commands.Network.Models.PSApplicationGateway for cmdlet Remove-AzureRmApplicationGatewayUrlPathMapConfig has properties that are complex types, this may result in unexpected siaply output.","Verify cmdlet output for Remove-AzureRmApplicationGatewayUrlPathMapConfig"
"Cmdlet Output Validator","Microsoft.Azure.Commands.Network","Set-AzureRmApplicationGatewayUrlPathMapConfig","1","Missing output format for cmdlet output type Microsoft.Azure.Commands.Network.Models.PSApplicationGateway","Add an output format for type Microsoft.Azure.Commands.Network.Models.PSApplicationGateway in Microsoft.Azure.Commands.Network.format.ps1xml, or verify the default output display is correct."
"Cmdlet Output Validator","Microsoft.Azure.Commands.Network","Set-AzureRmApplicationGatewayUrlPathMapConfig","3","The output type Microsoft.Azure.Commands.Network.Models.PSApplicationGateway for cmdlet Set-AzureRmApplicationGatewayUrlPathMapConfig has properties that are complex types, this may result in unexpected siaply output.","Verify cmdlet output for Set-AzureRmApplicationGatewayUrlPathMapConfig"
"Cmdlet Output Validator","Microsoft.Azure.Commands.Network","Get-AzureRmExpressRouteCircuit","3","The output type Microsoft.Azure.Commands.Network.Models.PSExpressRouteCircuit for cmdlet Get-AzureRmExpressRouteCircuit has properties that are complex types, this may result in unexpected siaply output.","Verify cmdlet output for Get-AzureRmExpressRouteCircuit"
"Cmdlet Output Validator","Microsoft.Azure.Commands.Network","New-AzureRmExpressRouteCircuit","3","The output type Microsoft.Azure.Commands.Network.Models.PSExpressRouteCircuit for cmdlet New-AzureRmExpressRouteCircuit has properties that are complex types, this may result in unexpected siaply output.","Verify cmdlet output for New-AzureRmExpressRouteCircuit"
"Cmdlet Output Validator","Microsoft.Azure.Commands.Network","Remove-AzureRmExpressRouteCircuit","0","The cmdlet Remove-AzureRmExpressRouteCircuit has no OutputType attribute.  Please add an OutputType attribute for each of the types the cmdlet may output.","Add OutputType attribute for each output type of cmdlet Remove-AzureRmExpressRouteCircuit."
"Cmdlet Output Validator","Microsoft.Azure.Commands.Network","Set-AzureRmExpressRouteCircuit","3","The output type Microsoft.Azure.Commands.Network.Models.PSExpressRouteCircuit for cmdlet Set-AzureRmExpressRouteCircuit has properties that are complex types, this may result in unexpected siaply output.","Verify cmdlet output for Set-AzureRmExpressRouteCircuit"
"Cmdlet Output Validator","Microsoft.Azure.Commands.Network","Add-AzureRmExpressRouteCircuitAuthorization","3","The output type Microsoft.Azure.Commands.Network.Models.PSExpressRouteCircuit for cmdlet Add-AzureRmExpressRouteCircuitAuthorization has properties that are complex types, this may result in unexpected siaply output.","Verify cmdlet output for Add-AzureRmExpressRouteCircuitAuthorization"
"Cmdlet Output Validator","Microsoft.Azure.Commands.Network","Get-AzureRmExpressRouteCircuitAuthorization","3","The output type Microsoft.Azure.Commands.Network.Models.PSExpressRouteCircuitAuthorization for cmdlet Get-AzureRmExpressRouteCircuitAuthorization has properties that are complex types, this may result in unexpected siaply output.","Verify cmdlet output for Get-AzureRmExpressRouteCircuitAuthorization"
"Cmdlet Output Validator","Microsoft.Azure.Commands.Network","New-AzureRmExpressRouteCircuitAuthorization","3","The output type Microsoft.Azure.Commands.Network.Models.PSExpressRouteCircuitAuthorization for cmdlet New-AzureRmExpressRouteCircuitAuthorization has properties that are complex types, this may result in unexpected siaply output.","Verify cmdlet output for New-AzureRmExpressRouteCircuitAuthorization"
"Cmdlet Output Validator","Microsoft.Azure.Commands.Network","Remove-AzureRmExpressRouteCircuitAuthorization","3","The output type Microsoft.Azure.Commands.Network.Models.PSExpressRouteCircuit for cmdlet Remove-AzureRmExpressRouteCircuitAuthorization has properties that are complex types, this may result in unexpected siaply output.","Verify cmdlet output for Remove-AzureRmExpressRouteCircuitAuthorization"
"Cmdlet Output Validator","Microsoft.Azure.Commands.Network","Add-AzureRmExpressRouteCircuitPeeringConfig","3","The output type Microsoft.Azure.Commands.Network.Models.PSExpressRouteCircuit for cmdlet Add-AzureRmExpressRouteCircuitPeeringConfig has properties that are complex types, this may result in unexpected siaply output.","Verify cmdlet output for Add-AzureRmExpressRouteCircuitPeeringConfig"
"Cmdlet Output Validator","Microsoft.Azure.Commands.Network","Get-AzureRmExpressRouteCircuitPeeringConfig","3","The output type Microsoft.Azure.Commands.Network.Models.PSPeering for cmdlet Get-AzureRmExpressRouteCircuitPeeringConfig has properties that are complex types, this may result in unexpected siaply output.","Verify cmdlet output for Get-AzureRmExpressRouteCircuitPeeringConfig"
"Cmdlet Output Validator","Microsoft.Azure.Commands.Network","New-AzureRmExpressRouteCircuitPeeringConfig","3","The output type Microsoft.Azure.Commands.Network.Models.PSPeering for cmdlet New-AzureRmExpressRouteCircuitPeeringConfig has properties that are complex types, this may result in unexpected siaply output.","Verify cmdlet output for New-AzureRmExpressRouteCircuitPeeringConfig"
"Cmdlet Output Validator","Microsoft.Azure.Commands.Network","Remove-AzureRmExpressRouteCircuitPeeringConfig","3","The output type Microsoft.Azure.Commands.Network.Models.PSExpressRouteCircuit for cmdlet Remove-AzureRmExpressRouteCircuitPeeringConfig has properties that are complex types, this may result in unexpected siaply output.","Verify cmdlet output for Remove-AzureRmExpressRouteCircuitPeeringConfig"
"Cmdlet Output Validator","Microsoft.Azure.Commands.Network","Set-AzureRmExpressRouteCircuitPeeringConfig","3","The output type Microsoft.Azure.Commands.Network.Models.PSExpressRouteCircuit for cmdlet Set-AzureRmExpressRouteCircuitPeeringConfig has properties that are complex types, this may result in unexpected siaply output.","Verify cmdlet output for Set-AzureRmExpressRouteCircuitPeeringConfig"
"Cmdlet Output Validator","Microsoft.Azure.Commands.Network","Get-AzureRmLoadBalancer","3","The output type Microsoft.Azure.Commands.Network.Models.PSLoadBalancer for cmdlet Get-AzureRmLoadBalancer has properties that are complex types, this may result in unexpected siaply output.","Verify cmdlet output for Get-AzureRmLoadBalancer"
"Cmdlet Output Validator","Microsoft.Azure.Commands.Network","New-AzureRmLoadBalancer","3","The output type Microsoft.Azure.Commands.Network.Models.PSLoadBalancer for cmdlet New-AzureRmLoadBalancer has properties that are complex types, this may result in unexpected siaply output.","Verify cmdlet output for New-AzureRmLoadBalancer"
"Cmdlet Output Validator","Microsoft.Azure.Commands.Network","Remove-AzureRmLoadBalancer","0","The cmdlet Remove-AzureRmLoadBalancer has no OutputType attribute.  Please add an OutputType attribute for each of the types the cmdlet may output.","Add OutputType attribute for each output type of cmdlet Remove-AzureRmLoadBalancer."
"Cmdlet Output Validator","Microsoft.Azure.Commands.Network","Set-AzureRmLoadBalancer","3","The output type Microsoft.Azure.Commands.Network.Models.PSLoadBalancer for cmdlet Set-AzureRmLoadBalancer has properties that are complex types, this may result in unexpected siaply output.","Verify cmdlet output for Set-AzureRmLoadBalancer"
"Cmdlet Output Validator","Microsoft.Azure.Commands.Network","Add-AzureRmLoadBalancerBackendAddressPoolConfig","3","The output type Microsoft.Azure.Commands.Network.Models.PSLoadBalancer for cmdlet Add-AzureRmLoadBalancerBackendAddressPoolConfig has properties that are complex types, this may result in unexpected siaply output.","Verify cmdlet output for Add-AzureRmLoadBalancerBackendAddressPoolConfig"
"Cmdlet Output Validator","Microsoft.Azure.Commands.Network","Get-AzureRmLoadBalancerBackendAddressPoolConfig","3","The output type Microsoft.Azure.Commands.Network.Models.PSBackendAddressPool for cmdlet Get-AzureRmLoadBalancerBackendAddressPoolConfig has properties that are complex types, this may result in unexpected siaply output.","Verify cmdlet output for Get-AzureRmLoadBalancerBackendAddressPoolConfig"
"Cmdlet Output Validator","Microsoft.Azure.Commands.Network","New-AzureRmLoadBalancerBackendAddressPoolConfig","3","The output type Microsoft.Azure.Commands.Network.Models.PSBackendAddressPool for cmdlet New-AzureRmLoadBalancerBackendAddressPoolConfig has properties that are complex types, this may result in unexpected siaply output.","Verify cmdlet output for New-AzureRmLoadBalancerBackendAddressPoolConfig"
"Cmdlet Output Validator","Microsoft.Azure.Commands.Network","Remove-AzureRmLoadBalancerBackendAddressPoolConfig","3","The output type Microsoft.Azure.Commands.Network.Models.PSLoadBalancer for cmdlet Remove-AzureRmLoadBalancerBackendAddressPoolConfig has properties that are complex types, this may result in unexpected siaply output.","Verify cmdlet output for Remove-AzureRmLoadBalancerBackendAddressPoolConfig"
"Cmdlet Output Validator","Microsoft.Azure.Commands.Network","Add-AzureRmLoadBalancerFrontendIpConfig","3","The output type Microsoft.Azure.Commands.Network.Models.PSLoadBalancer for cmdlet Add-AzureRmLoadBalancerFrontendIpConfig has properties that are complex types, this may result in unexpected siaply output.","Verify cmdlet output for Add-AzureRmLoadBalancerFrontendIpConfig"
"Cmdlet Output Validator","Microsoft.Azure.Commands.Network","Get-AzureRmLoadBalancerFrontendIpConfig","3","The output type Microsoft.Azure.Commands.Network.Models.PSFrontendIPConfiguration for cmdlet Get-AzureRmLoadBalancerFrontendIpConfig has properties that are complex types, this may result in unexpected siaply output.","Verify cmdlet output for Get-AzureRmLoadBalancerFrontendIpConfig"
"Cmdlet Output Validator","Microsoft.Azure.Commands.Network","New-AzureRmLoadBalancerFrontendIpConfig","3","The output type Microsoft.Azure.Commands.Network.Models.PSFrontendIPConfiguration for cmdlet New-AzureRmLoadBalancerFrontendIpConfig has properties that are complex types, this may result in unexpected siaply output.","Verify cmdlet output for New-AzureRmLoadBalancerFrontendIpConfig"
"Cmdlet Output Validator","Microsoft.Azure.Commands.Network","Remove-AzureRmLoadBalancerFrontendIpConfig","3","The output type Microsoft.Azure.Commands.Network.Models.PSLoadBalancer for cmdlet Remove-AzureRmLoadBalancerFrontendIpConfig has properties that are complex types, this may result in unexpected siaply output.","Verify cmdlet output for Remove-AzureRmLoadBalancerFrontendIpConfig"
"Cmdlet Output Validator","Microsoft.Azure.Commands.Network","Set-AzureRmLoadBalancerFrontendIpConfig","3","The output type Microsoft.Azure.Commands.Network.Models.PSLoadBalancer for cmdlet Set-AzureRmLoadBalancerFrontendIpConfig has properties that are complex types, this may result in unexpected siaply output.","Verify cmdlet output for Set-AzureRmLoadBalancerFrontendIpConfig"
"Cmdlet Output Validator","Microsoft.Azure.Commands.Network","Add-AzureRmLoadBalancerInboundNatPoolConfig","3","The output type Microsoft.Azure.Commands.Network.Models.PSLoadBalancer for cmdlet Add-AzureRmLoadBalancerInboundNatPoolConfig has properties that are complex types, this may result in unexpected siaply output.","Verify cmdlet output for Add-AzureRmLoadBalancerInboundNatPoolConfig"
"Cmdlet Output Validator","Microsoft.Azure.Commands.Network","Get-AzureRmLoadBalancerInboundNatPoolConfig","3","The output type Microsoft.Azure.Commands.Network.Models.PSInboundNatPool for cmdlet Get-AzureRmLoadBalancerInboundNatPoolConfig has properties that are complex types, this may result in unexpected siaply output.","Verify cmdlet output for Get-AzureRmLoadBalancerInboundNatPoolConfig"
"Cmdlet Output Validator","Microsoft.Azure.Commands.Network","New-AzureRmLoadBalancerInboundNatPoolConfig","3","The output type Microsoft.Azure.Commands.Network.Models.PSInboundNatPool for cmdlet New-AzureRmLoadBalancerInboundNatPoolConfig has properties that are complex types, this may result in unexpected siaply output.","Verify cmdlet output for New-AzureRmLoadBalancerInboundNatPoolConfig"
"Cmdlet Output Validator","Microsoft.Azure.Commands.Network","Remove-AzureRmLoadBalancerInboundNatPoolConfig","3","The output type Microsoft.Azure.Commands.Network.Models.PSLoadBalancer for cmdlet Remove-AzureRmLoadBalancerInboundNatPoolConfig has properties that are complex types, this may result in unexpected siaply output.","Verify cmdlet output for Remove-AzureRmLoadBalancerInboundNatPoolConfig"
"Cmdlet Output Validator","Microsoft.Azure.Commands.Network","Set-AzureRmLoadBalancerInboundNatPoolConfig","3","The output type Microsoft.Azure.Commands.Network.Models.PSLoadBalancer for cmdlet Set-AzureRmLoadBalancerInboundNatPoolConfig has properties that are complex types, this may result in unexpected siaply output.","Verify cmdlet output for Set-AzureRmLoadBalancerInboundNatPoolConfig"
"Cmdlet Output Validator","Microsoft.Azure.Commands.Network","Add-AzureRmLoadBalancerInboundNatRuleConfig","3","The output type Microsoft.Azure.Commands.Network.Models.PSLoadBalancer for cmdlet Add-AzureRmLoadBalancerInboundNatRuleConfig has properties that are complex types, this may result in unexpected siaply output.","Verify cmdlet output for Add-AzureRmLoadBalancerInboundNatRuleConfig"
"Cmdlet Output Validator","Microsoft.Azure.Commands.Network","Get-AzureRmLoadBalancerInboundNatRuleConfig","3","The output type Microsoft.Azure.Commands.Network.Models.PSInboundNatRule for cmdlet Get-AzureRmLoadBalancerInboundNatRuleConfig has properties that are complex types, this may result in unexpected siaply output.","Verify cmdlet output for Get-AzureRmLoadBalancerInboundNatRuleConfig"
"Cmdlet Output Validator","Microsoft.Azure.Commands.Network","New-AzureRmLoadBalancerInboundNatRuleConfig","3","The output type Microsoft.Azure.Commands.Network.Models.PSInboundNatRule for cmdlet New-AzureRmLoadBalancerInboundNatRuleConfig has properties that are complex types, this may result in unexpected siaply output.","Verify cmdlet output for New-AzureRmLoadBalancerInboundNatRuleConfig"
"Cmdlet Output Validator","Microsoft.Azure.Commands.Network","Remove-AzureRmLoadBalancerInboundNatRuleConfig","3","The output type Microsoft.Azure.Commands.Network.Models.PSLoadBalancer for cmdlet Remove-AzureRmLoadBalancerInboundNatRuleConfig has properties that are complex types, this may result in unexpected siaply output.","Verify cmdlet output for Remove-AzureRmLoadBalancerInboundNatRuleConfig"
"Cmdlet Output Validator","Microsoft.Azure.Commands.Network","Set-AzureRmLoadBalancerInboundNatRuleConfig","3","The output type Microsoft.Azure.Commands.Network.Models.PSLoadBalancer for cmdlet Set-AzureRmLoadBalancerInboundNatRuleConfig has properties that are complex types, this may result in unexpected siaply output.","Verify cmdlet output for Set-AzureRmLoadBalancerInboundNatRuleConfig"
"Cmdlet Output Validator","Microsoft.Azure.Commands.Network","Add-AzureRmLoadBalancerRuleConfig","3","The output type Microsoft.Azure.Commands.Network.Models.PSLoadBalancer for cmdlet Add-AzureRmLoadBalancerRuleConfig has properties that are complex types, this may result in unexpected siaply output.","Verify cmdlet output for Add-AzureRmLoadBalancerRuleConfig"
"Cmdlet Output Validator","Microsoft.Azure.Commands.Network","Get-AzureRmLoadBalancerRuleConfig","3","The output type Microsoft.Azure.Commands.Network.Models.PSLoadBalancingRule for cmdlet Get-AzureRmLoadBalancerRuleConfig has properties that are complex types, this may result in unexpected siaply output.","Verify cmdlet output for Get-AzureRmLoadBalancerRuleConfig"
"Cmdlet Output Validator","Microsoft.Azure.Commands.Network","New-AzureRmLoadBalancerRuleConfig","3","The output type Microsoft.Azure.Commands.Network.Models.PSLoadBalancingRule for cmdlet New-AzureRmLoadBalancerRuleConfig has properties that are complex types, this may result in unexpected siaply output.","Verify cmdlet output for New-AzureRmLoadBalancerRuleConfig"
"Cmdlet Output Validator","Microsoft.Azure.Commands.Network","Remove-AzureRmLoadBalancerRuleConfig","3","The output type Microsoft.Azure.Commands.Network.Models.PSLoadBalancer for cmdlet Remove-AzureRmLoadBalancerRuleConfig has properties that are complex types, this may result in unexpected siaply output.","Verify cmdlet output for Remove-AzureRmLoadBalancerRuleConfig"
"Cmdlet Output Validator","Microsoft.Azure.Commands.Network","Set-AzureRmLoadBalancerRuleConfig","3","The output type Microsoft.Azure.Commands.Network.Models.PSLoadBalancer for cmdlet Set-AzureRmLoadBalancerRuleConfig has properties that are complex types, this may result in unexpected siaply output.","Verify cmdlet output for Set-AzureRmLoadBalancerRuleConfig"
"Cmdlet Output Validator","Microsoft.Azure.Commands.Network","Add-AzureRmLoadBalancerProbeConfig","3","The output type Microsoft.Azure.Commands.Network.Models.PSLoadBalancer for cmdlet Add-AzureRmLoadBalancerProbeConfig has properties that are complex types, this may result in unexpected siaply output.","Verify cmdlet output for Add-AzureRmLoadBalancerProbeConfig"
"Cmdlet Output Validator","Microsoft.Azure.Commands.Network","Get-AzureRmLoadBalancerProbeConfig","3","The output type Microsoft.Azure.Commands.Network.Models.PSProbe for cmdlet Get-AzureRmLoadBalancerProbeConfig has properties that are complex types, this may result in unexpected siaply output.","Verify cmdlet output for Get-AzureRmLoadBalancerProbeConfig"
"Cmdlet Output Validator","Microsoft.Azure.Commands.Network","New-AzureRmLoadBalancerProbeConfig","3","The output type Microsoft.Azure.Commands.Network.Models.PSProbe for cmdlet New-AzureRmLoadBalancerProbeConfig has properties that are complex types, this may result in unexpected siaply output.","Verify cmdlet output for New-AzureRmLoadBalancerProbeConfig"
"Cmdlet Output Validator","Microsoft.Azure.Commands.Network","Remove-AzureRmLoadBalancerProbeConfig","3","The output type Microsoft.Azure.Commands.Network.Models.PSLoadBalancer for cmdlet Remove-AzureRmLoadBalancerProbeConfig has properties that are complex types, this may result in unexpected siaply output.","Verify cmdlet output for Remove-AzureRmLoadBalancerProbeConfig"
"Cmdlet Output Validator","Microsoft.Azure.Commands.Network","Set-AzureRmLoadBalancerProbeConfig","3","The output type Microsoft.Azure.Commands.Network.Models.PSLoadBalancer for cmdlet Set-AzureRmLoadBalancerProbeConfig has properties that are complex types, this may result in unexpected siaply output.","Verify cmdlet output for Set-AzureRmLoadBalancerProbeConfig"
"Cmdlet Output Validator","Microsoft.Azure.Commands.Network","Get-AzureRmLocalNetworkGateway","1","Missing output format for cmdlet output type Microsoft.Azure.Commands.Network.Models.PSLocalNetworkGateway","Add an output format for type Microsoft.Azure.Commands.Network.Models.PSLocalNetworkGateway in Microsoft.Azure.Commands.Network.format.ps1xml, or verify the default output display is correct."
"Cmdlet Output Validator","Microsoft.Azure.Commands.Network","Get-AzureRmLocalNetworkGateway","3","The output type Microsoft.Azure.Commands.Network.Models.PSLocalNetworkGateway for cmdlet Get-AzureRmLocalNetworkGateway has properties that are complex types, this may result in unexpected siaply output.","Verify cmdlet output for Get-AzureRmLocalNetworkGateway"
"Cmdlet Output Validator","Microsoft.Azure.Commands.Network","New-AzureRmLocalNetworkGateway","1","Missing output format for cmdlet output type Microsoft.Azure.Commands.Network.Models.PSLocalNetworkGateway","Add an output format for type Microsoft.Azure.Commands.Network.Models.PSLocalNetworkGateway in Microsoft.Azure.Commands.Network.format.ps1xml, or verify the default output display is correct."
"Cmdlet Output Validator","Microsoft.Azure.Commands.Network","New-AzureRmLocalNetworkGateway","3","The output type Microsoft.Azure.Commands.Network.Models.PSLocalNetworkGateway for cmdlet New-AzureRmLocalNetworkGateway has properties that are complex types, this may result in unexpected siaply output.","Verify cmdlet output for New-AzureRmLocalNetworkGateway"
"Cmdlet Output Validator","Microsoft.Azure.Commands.Network","Remove-AzureRmLocalNetworkGateway","0","The cmdlet Remove-AzureRmLocalNetworkGateway has no OutputType attribute.  Please add an OutputType attribute for each of the types the cmdlet may output.","Add OutputType attribute for each output type of cmdlet Remove-AzureRmLocalNetworkGateway."
"Cmdlet Output Validator","Microsoft.Azure.Commands.Network","Set-AzureRmLocalNetworkGateway","1","Missing output format for cmdlet output type Microsoft.Azure.Commands.Network.Models.PSLocalNetworkGateway","Add an output format for type Microsoft.Azure.Commands.Network.Models.PSLocalNetworkGateway in Microsoft.Azure.Commands.Network.format.ps1xml, or verify the default output display is correct."
"Cmdlet Output Validator","Microsoft.Azure.Commands.Network","Set-AzureRmLocalNetworkGateway","3","The output type Microsoft.Azure.Commands.Network.Models.PSLocalNetworkGateway for cmdlet Set-AzureRmLocalNetworkGateway has properties that are complex types, this may result in unexpected siaply output.","Verify cmdlet output for Set-AzureRmLocalNetworkGateway"
"Cmdlet Output Validator","Microsoft.Azure.Commands.Network","Get-AzureRmNetworkInterface","3","The output type Microsoft.Azure.Commands.Network.Models.PSNetworkInterface for cmdlet Get-AzureRmNetworkInterface has properties that are complex types, this may result in unexpected siaply output.","Verify cmdlet output for Get-AzureRmNetworkInterface"
"Cmdlet Output Validator","Microsoft.Azure.Commands.Network","New-AzureRmNetworkInterface","3","The output type Microsoft.Azure.Commands.Network.Models.PSNetworkInterface for cmdlet New-AzureRmNetworkInterface has properties that are complex types, this may result in unexpected siaply output.","Verify cmdlet output for New-AzureRmNetworkInterface"
"Cmdlet Output Validator","Microsoft.Azure.Commands.Network","Remove-AzureRmNetworkInterface","0","The cmdlet Remove-AzureRmNetworkInterface has no OutputType attribute.  Please add an OutputType attribute for each of the types the cmdlet may output.","Add OutputType attribute for each output type of cmdlet Remove-AzureRmNetworkInterface."
"Cmdlet Output Validator","Microsoft.Azure.Commands.Network","Set-AzureRmNetworkInterface","3","The output type Microsoft.Azure.Commands.Network.Models.PSNetworkInterface for cmdlet Set-AzureRmNetworkInterface has properties that are complex types, this may result in unexpected siaply output.","Verify cmdlet output for Set-AzureRmNetworkInterface"
"Cmdlet Output Validator","Microsoft.Azure.Commands.Network","Get-AzureRmNetworkSecurityGroup","3","The output type Microsoft.Azure.Commands.Network.Models.PSNetworkSecurityGroup for cmdlet Get-AzureRmNetworkSecurityGroup has properties that are complex types, this may result in unexpected siaply output.","Verify cmdlet output for Get-AzureRmNetworkSecurityGroup"
"Cmdlet Output Validator","Microsoft.Azure.Commands.Network","New-AzureRmNetworkSecurityGroup","3","The output type Microsoft.Azure.Commands.Network.Models.PSNetworkSecurityGroup for cmdlet New-AzureRmNetworkSecurityGroup has properties that are complex types, this may result in unexpected siaply output.","Verify cmdlet output for New-AzureRmNetworkSecurityGroup"
"Cmdlet Output Validator","Microsoft.Azure.Commands.Network","Remove-AzureRmNetworkSecurityGroup","0","The cmdlet Remove-AzureRmNetworkSecurityGroup has no OutputType attribute.  Please add an OutputType attribute for each of the types the cmdlet may output.","Add OutputType attribute for each output type of cmdlet Remove-AzureRmNetworkSecurityGroup."
"Cmdlet Output Validator","Microsoft.Azure.Commands.Network","Set-AzureRmNetworkSecurityGroup","3","The output type Microsoft.Azure.Commands.Network.Models.PSNetworkSecurityGroup for cmdlet Set-AzureRmNetworkSecurityGroup has properties that are complex types, this may result in unexpected siaply output.","Verify cmdlet output for Set-AzureRmNetworkSecurityGroup"
"Cmdlet Output Validator","Microsoft.Azure.Commands.Network","Add-AzureRmNetworkSecurityRuleConfig","3","The output type Microsoft.Azure.Commands.Network.Models.PSNetworkSecurityGroup for cmdlet Add-AzureRmNetworkSecurityRuleConfig has properties that are complex types, this may result in unexpected siaply output.","Verify cmdlet output for Add-AzureRmNetworkSecurityRuleConfig"
"Cmdlet Output Validator","Microsoft.Azure.Commands.Network","Get-AzureRmNetworkSecurityRuleConfig","3","The output type Microsoft.Azure.Commands.Network.Models.PSSecurityRule for cmdlet Get-AzureRmNetworkSecurityRuleConfig has properties that are complex types, this may result in unexpected siaply output.","Verify cmdlet output for Get-AzureRmNetworkSecurityRuleConfig"
"Cmdlet Output Validator","Microsoft.Azure.Commands.Network","New-AzureRmNetworkSecurityRuleConfig","3","The output type Microsoft.Azure.Commands.Network.Models.PSSecurityRule for cmdlet New-AzureRmNetworkSecurityRuleConfig has properties that are complex types, this may result in unexpected siaply output.","Verify cmdlet output for New-AzureRmNetworkSecurityRuleConfig"
"Cmdlet Output Validator","Microsoft.Azure.Commands.Network","Remove-AzureRmNetworkSecurityRuleConfig","3","The output type Microsoft.Azure.Commands.Network.Models.PSNetworkSecurityGroup for cmdlet Remove-AzureRmNetworkSecurityRuleConfig has properties that are complex types, this may result in unexpected siaply output.","Verify cmdlet output for Remove-AzureRmNetworkSecurityRuleConfig"
"Cmdlet Output Validator","Microsoft.Azure.Commands.Network","Set-AzureRmNetworkSecurityRuleConfig","3","The output type Microsoft.Azure.Commands.Network.Models.PSNetworkSecurityGroup for cmdlet Set-AzureRmNetworkSecurityRuleConfig has properties that are complex types, this may result in unexpected siaply output.","Verify cmdlet output for Set-AzureRmNetworkSecurityRuleConfig"
"Cmdlet Output Validator","Microsoft.Azure.Commands.Network","Get-AzureRmExpressRouteServiceProvider","3","The output type Microsoft.Azure.Commands.Network.Models.PSExpressRouteServiceProvider for cmdlet Get-AzureRmExpressRouteServiceProvider has properties that are complex types, this may result in unexpected siaply output.","Verify cmdlet output for Get-AzureRmExpressRouteServiceProvider"
"Cmdlet Output Validator","Microsoft.Azure.Commands.Network","Get-AzureRmPublicIpAddress","3","The output type Microsoft.Azure.Commands.Network.Models.PSPublicIpAddress for cmdlet Get-AzureRmPublicIpAddress has properties that are complex types, this may result in unexpected siaply output.","Verify cmdlet output for Get-AzureRmPublicIpAddress"
"Cmdlet Output Validator","Microsoft.Azure.Commands.Network","New-AzureRmPublicIpAddress","3","The output type Microsoft.Azure.Commands.Network.Models.PSPublicIpAddress for cmdlet New-AzureRmPublicIpAddress has properties that are complex types, this may result in unexpected siaply output.","Verify cmdlet output for New-AzureRmPublicIpAddress"
"Cmdlet Output Validator","Microsoft.Azure.Commands.Network","Remove-AzureRmPublicIpAddress","0","The cmdlet Remove-AzureRmPublicIpAddress has no OutputType attribute.  Please add an OutputType attribute for each of the types the cmdlet may output.","Add OutputType attribute for each output type of cmdlet Remove-AzureRmPublicIpAddress."
"Cmdlet Output Validator","Microsoft.Azure.Commands.Network","Set-AzureRmPublicIpAddress","3","The output type Microsoft.Azure.Commands.Network.Models.PSPublicIpAddress for cmdlet Set-AzureRmPublicIpAddress has properties that are complex types, this may result in unexpected siaply output.","Verify cmdlet output for Set-AzureRmPublicIpAddress"
"Cmdlet Output Validator","Microsoft.Azure.Commands.Network","Get-AzureRmRouteTable","3","The output type Microsoft.Azure.Commands.Network.Models.PSRouteTable for cmdlet Get-AzureRmRouteTable has properties that are complex types, this may result in unexpected siaply output.","Verify cmdlet output for Get-AzureRmRouteTable"
"Cmdlet Output Validator","Microsoft.Azure.Commands.Network","New-AzureRmRouteTable","3","The output type Microsoft.Azure.Commands.Network.Models.PSRouteTable for cmdlet New-AzureRmRouteTable has properties that are complex types, this may result in unexpected siaply output.","Verify cmdlet output for New-AzureRmRouteTable"
"Cmdlet Output Validator","Microsoft.Azure.Commands.Network","Remove-AzureRmRouteTable","0","The cmdlet Remove-AzureRmRouteTable has no OutputType attribute.  Please add an OutputType attribute for each of the types the cmdlet may output.","Add OutputType attribute for each output type of cmdlet Remove-AzureRmRouteTable."
"Cmdlet Output Validator","Microsoft.Azure.Commands.Network","Set-AzureRmRouteTable","3","The output type Microsoft.Azure.Commands.Network.Models.PSRouteTable for cmdlet Set-AzureRmRouteTable has properties that are complex types, this may result in unexpected siaply output.","Verify cmdlet output for Set-AzureRmRouteTable"
"Cmdlet Output Validator","Microsoft.Azure.Commands.Network","Add-AzureRmRouteConfig","3","The output type Microsoft.Azure.Commands.Network.Models.PSRouteTable for cmdlet Add-AzureRmRouteConfig has properties that are complex types, this may result in unexpected siaply output.","Verify cmdlet output for Add-AzureRmRouteConfig"
"Cmdlet Output Validator","Microsoft.Azure.Commands.Network","Get-AzureRmRouteConfig","3","The output type Microsoft.Azure.Commands.Network.Models.PSRoute for cmdlet Get-AzureRmRouteConfig has properties that are complex types, this may result in unexpected siaply output.","Verify cmdlet output for Get-AzureRmRouteConfig"
"Cmdlet Output Validator","Microsoft.Azure.Commands.Network","New-AzureRmRouteConfig","3","The output type Microsoft.Azure.Commands.Network.Models.PSRoute for cmdlet New-AzureRmRouteConfig has properties that are complex types, this may result in unexpected siaply output.","Verify cmdlet output for New-AzureRmRouteConfig"
"Cmdlet Output Validator","Microsoft.Azure.Commands.Network","Remove-AzureRmRouteConfig","3","The output type Microsoft.Azure.Commands.Network.Models.PSRouteTable for cmdlet Remove-AzureRmRouteConfig has properties that are complex types, this may result in unexpected siaply output.","Verify cmdlet output for Remove-AzureRmRouteConfig"
"Cmdlet Output Validator","Microsoft.Azure.Commands.Network","Set-AzureRmRouteConfig","3","The output type Microsoft.Azure.Commands.Network.Models.PSRouteTable for cmdlet Set-AzureRmRouteConfig has properties that are complex types, this may result in unexpected siaply output.","Verify cmdlet output for Set-AzureRmRouteConfig"
"Cmdlet Output Validator","Microsoft.Azure.Commands.Network","Get-AzureRmVirtualNetwork","3","The output type Microsoft.Azure.Commands.Network.Models.PSVirtualNetwork for cmdlet Get-AzureRmVirtualNetwork has properties that are complex types, this may result in unexpected siaply output.","Verify cmdlet output for Get-AzureRmVirtualNetwork"
"Cmdlet Output Validator","Microsoft.Azure.Commands.Network","New-AzureRmVirtualNetwork","3","The output type Microsoft.Azure.Commands.Network.Models.PSVirtualNetwork for cmdlet New-AzureRmVirtualNetwork has properties that are complex types, this may result in unexpected siaply output.","Verify cmdlet output for New-AzureRmVirtualNetwork"
"Cmdlet Output Validator","Microsoft.Azure.Commands.Network","Remove-AzureRmVirtualNetwork","0","The cmdlet Remove-AzureRmVirtualNetwork has no OutputType attribute.  Please add an OutputType attribute for each of the types the cmdlet may output.","Add OutputType attribute for each output type of cmdlet Remove-AzureRmVirtualNetwork."
"Cmdlet Output Validator","Microsoft.Azure.Commands.Network","Set-AzureRmVirtualNetwork","3","The output type Microsoft.Azure.Commands.Network.Models.PSVirtualNetwork for cmdlet Set-AzureRmVirtualNetwork has properties that are complex types, this may result in unexpected siaply output.","Verify cmdlet output for Set-AzureRmVirtualNetwork"
"Cmdlet Output Validator","Microsoft.Azure.Commands.Network","Add-AzureRmVirtualNetworkSubnetConfig","3","The output type Microsoft.Azure.Commands.Network.Models.PSVirtualNetwork for cmdlet Add-AzureRmVirtualNetworkSubnetConfig has properties that are complex types, this may result in unexpected siaply output.","Verify cmdlet output for Add-AzureRmVirtualNetworkSubnetConfig"
"Cmdlet Output Validator","Microsoft.Azure.Commands.Network","Get-AzureRmVirtualNetworkSubnetConfig","3","The output type Microsoft.Azure.Commands.Network.Models.PSSubnet for cmdlet Get-AzureRmVirtualNetworkSubnetConfig has properties that are complex types, this may result in unexpected siaply output.","Verify cmdlet output for Get-AzureRmVirtualNetworkSubnetConfig"
"Cmdlet Output Validator","Microsoft.Azure.Commands.Network","New-AzureRmVirtualNetworkSubnetConfig","3","The output type Microsoft.Azure.Commands.Network.Models.PSSubnet for cmdlet New-AzureRmVirtualNetworkSubnetConfig has properties that are complex types, this may result in unexpected siaply output.","Verify cmdlet output for New-AzureRmVirtualNetworkSubnetConfig"
"Cmdlet Output Validator","Microsoft.Azure.Commands.Network","Remove-AzureRmVirtualNetworkSubnetConfig","3","The output type Microsoft.Azure.Commands.Network.Models.PSVirtualNetwork for cmdlet Remove-AzureRmVirtualNetworkSubnetConfig has properties that are complex types, this may result in unexpected siaply output.","Verify cmdlet output for Remove-AzureRmVirtualNetworkSubnetConfig"
"Cmdlet Output Validator","Microsoft.Azure.Commands.Network","Set-AzureRmVirtualNetworkSubnetConfig","3","The output type Microsoft.Azure.Commands.Network.Models.PSVirtualNetwork for cmdlet Set-AzureRmVirtualNetworkSubnetConfig has properties that are complex types, this may result in unexpected siaply output.","Verify cmdlet output for Set-AzureRmVirtualNetworkSubnetConfig"
"Cmdlet Output Validator","Microsoft.Azure.Commands.Network","Add-AzureRmVpnClientRevokedCertificate","1","Missing output format for cmdlet output type Microsoft.Azure.Commands.Network.Models.PSVpnClientRevokedCertificate","Add an output format for type Microsoft.Azure.Commands.Network.Models.PSVpnClientRevokedCertificate in Microsoft.Azure.Commands.Network.format.ps1xml, or verify the default output display is correct."
"Cmdlet Output Validator","Microsoft.Azure.Commands.Network","Add-AzureRmVpnClientRevokedCertificate","3","The output type Microsoft.Azure.Commands.Network.Models.PSVpnClientRevokedCertificate for cmdlet Add-AzureRmVpnClientRevokedCertificate has properties that are complex types, this may result in unexpected siaply output.","Verify cmdlet output for Add-AzureRmVpnClientRevokedCertificate"
"Cmdlet Output Validator","Microsoft.Azure.Commands.Network","Add-AzureRmVpnClientRootCertificate","1","Missing output format for cmdlet output type Microsoft.Azure.Commands.Network.Models.PSVpnClientRootCertificate","Add an output format for type Microsoft.Azure.Commands.Network.Models.PSVpnClientRootCertificate in Microsoft.Azure.Commands.Network.format.ps1xml, or verify the default output display is correct."
"Cmdlet Output Validator","Microsoft.Azure.Commands.Network","Add-AzureRmVpnClientRootCertificate","3","The output type Microsoft.Azure.Commands.Network.Models.PSVpnClientRootCertificate for cmdlet Add-AzureRmVpnClientRootCertificate has properties that are complex types, this may result in unexpected siaply output.","Verify cmdlet output for Add-AzureRmVpnClientRootCertificate"
"Cmdlet Output Validator","Microsoft.Azure.Commands.Network","Get-AzureRmVirtualNetworkGateway","1","Missing output format for cmdlet output type Microsoft.Azure.Commands.Network.Models.PSVirtualNetworkGateway","Add an output format for type Microsoft.Azure.Commands.Network.Models.PSVirtualNetworkGateway in Microsoft.Azure.Commands.Network.format.ps1xml, or verify the default output display is correct."
"Cmdlet Output Validator","Microsoft.Azure.Commands.Network","Get-AzureRmVirtualNetworkGateway","3","The output type Microsoft.Azure.Commands.Network.Models.PSVirtualNetworkGateway for cmdlet Get-AzureRmVirtualNetworkGateway has properties that are complex types, this may result in unexpected siaply output.","Verify cmdlet output for Get-AzureRmVirtualNetworkGateway"
"Cmdlet Output Validator","Microsoft.Azure.Commands.Network","Get-AzureRmVpnClientRevokedCertificate","1","Missing output format for cmdlet output type Microsoft.Azure.Commands.Network.Models.PSVpnClientRevokedCertificate","Add an output format for type Microsoft.Azure.Commands.Network.Models.PSVpnClientRevokedCertificate in Microsoft.Azure.Commands.Network.format.ps1xml, or verify the default output display is correct."
"Cmdlet Output Validator","Microsoft.Azure.Commands.Network","Get-AzureRmVpnClientRevokedCertificate","3","The output type Microsoft.Azure.Commands.Network.Models.PSVpnClientRevokedCertificate for cmdlet Get-AzureRmVpnClientRevokedCertificate has properties that are complex types, this may result in unexpected siaply output.","Verify cmdlet output for Get-AzureRmVpnClientRevokedCertificate"
"Cmdlet Output Validator","Microsoft.Azure.Commands.Network","Get-AzureRmVpnClientRootCertificate","1","Missing output format for cmdlet output type Microsoft.Azure.Commands.Network.Models.PSVpnClientRootCertificate","Add an output format for type Microsoft.Azure.Commands.Network.Models.PSVpnClientRootCertificate in Microsoft.Azure.Commands.Network.format.ps1xml, or verify the default output display is correct."
"Cmdlet Output Validator","Microsoft.Azure.Commands.Network","Get-AzureRmVpnClientRootCertificate","3","The output type Microsoft.Azure.Commands.Network.Models.PSVpnClientRootCertificate for cmdlet Get-AzureRmVpnClientRootCertificate has properties that are complex types, this may result in unexpected siaply output.","Verify cmdlet output for Get-AzureRmVpnClientRootCertificate"
"Cmdlet Output Validator","Microsoft.Azure.Commands.Network","New-AzureRmVirtualNetworkGateway","1","Missing output format for cmdlet output type Microsoft.Azure.Commands.Network.Models.PSVirtualNetworkGateway","Add an output format for type Microsoft.Azure.Commands.Network.Models.PSVirtualNetworkGateway in Microsoft.Azure.Commands.Network.format.ps1xml, or verify the default output display is correct."
"Cmdlet Output Validator","Microsoft.Azure.Commands.Network","New-AzureRmVirtualNetworkGateway","3","The output type Microsoft.Azure.Commands.Network.Models.PSVirtualNetworkGateway for cmdlet New-AzureRmVirtualNetworkGateway has properties that are complex types, this may result in unexpected siaply output.","Verify cmdlet output for New-AzureRmVirtualNetworkGateway"
"Cmdlet Output Validator","Microsoft.Azure.Commands.Network","New-AzureRmVirtualNetworkGatewayIpConfig","1","Missing output format for cmdlet output type Microsoft.Azure.Commands.Network.Models.PSVirtualNetworkGatewayIpConfiguration","Add an output format for type Microsoft.Azure.Commands.Network.Models.PSVirtualNetworkGatewayIpConfiguration in Microsoft.Azure.Commands.Network.format.ps1xml, or verify the default output display is correct."
"Cmdlet Output Validator","Microsoft.Azure.Commands.Network","New-AzureRmVirtualNetworkGatewayIpConfig","3","The output type Microsoft.Azure.Commands.Network.Models.PSVirtualNetworkGatewayIpConfiguration for cmdlet New-AzureRmVirtualNetworkGatewayIpConfig has properties that are complex types, this may result in unexpected siaply output.","Verify cmdlet output for New-AzureRmVirtualNetworkGatewayIpConfig"
"Cmdlet Output Validator","Microsoft.Azure.Commands.Network","New-AzureRmVpnClientRevokedCertificate","1","Missing output format for cmdlet output type Microsoft.Azure.Commands.Network.Models.PSVpnClientRevokedCertificate","Add an output format for type Microsoft.Azure.Commands.Network.Models.PSVpnClientRevokedCertificate in Microsoft.Azure.Commands.Network.format.ps1xml, or verify the default output display is correct."
"Cmdlet Output Validator","Microsoft.Azure.Commands.Network","New-AzureRmVpnClientRevokedCertificate","3","The output type Microsoft.Azure.Commands.Network.Models.PSVpnClientRevokedCertificate for cmdlet New-AzureRmVpnClientRevokedCertificate has properties that are complex types, this may result in unexpected siaply output.","Verify cmdlet output for New-AzureRmVpnClientRevokedCertificate"
"Cmdlet Output Validator","Microsoft.Azure.Commands.Network","New-AzureRmVpnClientRootCertificate","1","Missing output format for cmdlet output type Microsoft.Azure.Commands.Network.Models.PSVpnClientRootCertificate","Add an output format for type Microsoft.Azure.Commands.Network.Models.PSVpnClientRootCertificate in Microsoft.Azure.Commands.Network.format.ps1xml, or verify the default output display is correct."
"Cmdlet Output Validator","Microsoft.Azure.Commands.Network","New-AzureRmVpnClientRootCertificate","3","The output type Microsoft.Azure.Commands.Network.Models.PSVpnClientRootCertificate for cmdlet New-AzureRmVpnClientRootCertificate has properties that are complex types, this may result in unexpected siaply output.","Verify cmdlet output for New-AzureRmVpnClientRootCertificate"
"Cmdlet Output Validator","Microsoft.Azure.Commands.Network","Remove-AzureRmVirtualNetworkGateway","0","The cmdlet Remove-AzureRmVirtualNetworkGateway has no OutputType attribute.  Please add an OutputType attribute for each of the types the cmdlet may output.","Add OutputType attribute for each output type of cmdlet Remove-AzureRmVirtualNetworkGateway."
"Cmdlet Output Validator","Microsoft.Azure.Commands.Network","Remove-AzureRmVirtualNetworkGatewayDefaultSite","1","Missing output format for cmdlet output type Microsoft.Azure.Commands.Network.Models.PSVirtualNetworkGateway","Add an output format for type Microsoft.Azure.Commands.Network.Models.PSVirtualNetworkGateway in Microsoft.Azure.Commands.Network.format.ps1xml, or verify the default output display is correct."
"Cmdlet Output Validator","Microsoft.Azure.Commands.Network","Remove-AzureRmVirtualNetworkGatewayDefaultSite","3","The output type Microsoft.Azure.Commands.Network.Models.PSVirtualNetworkGateway for cmdlet Remove-AzureRmVirtualNetworkGatewayDefaultSite has properties that are complex types, this may result in unexpected siaply output.","Verify cmdlet output for Remove-AzureRmVirtualNetworkGatewayDefaultSite"
"Cmdlet Output Validator","Microsoft.Azure.Commands.Network","Remove-AzureRmVpnClientRevokedCertificate","0","The cmdlet Remove-AzureRmVpnClientRevokedCertificate has no OutputType attribute.  Please add an OutputType attribute for each of the types the cmdlet may output.","Add OutputType attribute for each output type of cmdlet Remove-AzureRmVpnClientRevokedCertificate."
"Cmdlet Output Validator","Microsoft.Azure.Commands.Network","Remove-AzureRmVpnClientRootCertificate","0","The cmdlet Remove-AzureRmVpnClientRootCertificate has no OutputType attribute.  Please add an OutputType attribute for each of the types the cmdlet may output.","Add OutputType attribute for each output type of cmdlet Remove-AzureRmVpnClientRootCertificate."
"Cmdlet Output Validator","Microsoft.Azure.Commands.Network","Reset-AzureRmVirtualNetworkGateway","1","Missing output format for cmdlet output type Microsoft.Azure.Commands.Network.Models.PSVirtualNetworkGateway","Add an output format for type Microsoft.Azure.Commands.Network.Models.PSVirtualNetworkGateway in Microsoft.Azure.Commands.Network.format.ps1xml, or verify the default output display is correct."
"Cmdlet Output Validator","Microsoft.Azure.Commands.Network","Reset-AzureRmVirtualNetworkGateway","3","The output type Microsoft.Azure.Commands.Network.Models.PSVirtualNetworkGateway for cmdlet Reset-AzureRmVirtualNetworkGateway has properties that are complex types, this may result in unexpected siaply output.","Verify cmdlet output for Reset-AzureRmVirtualNetworkGateway"
"Cmdlet Output Validator","Microsoft.Azure.Commands.Network","Resize-AzureRmVirtualNetworkGateway","1","Missing output format for cmdlet output type Microsoft.Azure.Commands.Network.Models.PSVirtualNetworkGateway","Add an output format for type Microsoft.Azure.Commands.Network.Models.PSVirtualNetworkGateway in Microsoft.Azure.Commands.Network.format.ps1xml, or verify the default output display is correct."
"Cmdlet Output Validator","Microsoft.Azure.Commands.Network","Resize-AzureRmVirtualNetworkGateway","3","The output type Microsoft.Azure.Commands.Network.Models.PSVirtualNetworkGateway for cmdlet Resize-AzureRmVirtualNetworkGateway has properties that are complex types, this may result in unexpected siaply output.","Verify cmdlet output for Resize-AzureRmVirtualNetworkGateway"
"Cmdlet Output Validator","Microsoft.Azure.Commands.Network","Set-AzureRmVirtualNetworkGatewayDefaultSite","1","Missing output format for cmdlet output type Microsoft.Azure.Commands.Network.Models.PSVirtualNetworkGateway","Add an output format for type Microsoft.Azure.Commands.Network.Models.PSVirtualNetworkGateway in Microsoft.Azure.Commands.Network.format.ps1xml, or verify the default output display is correct."
"Cmdlet Output Validator","Microsoft.Azure.Commands.Network","Set-AzureRmVirtualNetworkGatewayDefaultSite","3","The output type Microsoft.Azure.Commands.Network.Models.PSVirtualNetworkGateway for cmdlet Set-AzureRmVirtualNetworkGatewayDefaultSite has properties that are complex types, this may result in unexpected siaply output.","Verify cmdlet output for Set-AzureRmVirtualNetworkGatewayDefaultSite"
"Cmdlet Output Validator","Microsoft.Azure.Commands.Network","Set-AzureRmVirtualNetworkGatewayVpnClientConfig","1","Missing output format for cmdlet output type Microsoft.Azure.Commands.Network.Models.PSVirtualNetworkGateway","Add an output format for type Microsoft.Azure.Commands.Network.Models.PSVirtualNetworkGateway in Microsoft.Azure.Commands.Network.format.ps1xml, or verify the default output display is correct."
"Cmdlet Output Validator","Microsoft.Azure.Commands.Network","Set-AzureRmVirtualNetworkGatewayVpnClientConfig","3","The output type Microsoft.Azure.Commands.Network.Models.PSVirtualNetworkGateway for cmdlet Set-AzureRmVirtualNetworkGatewayVpnClientConfig has properties that are complex types, this may result in unexpected siaply output.","Verify cmdlet output for Set-AzureRmVirtualNetworkGatewayVpnClientConfig"
"Cmdlet Output Validator","Microsoft.Azure.Commands.Network","Get-AzureRmVirtualNetworkGatewayConnection","1","Missing output format for cmdlet output type Microsoft.Azure.Commands.Network.Models.PSVirtualNetworkGatewayConnection","Add an output format for type Microsoft.Azure.Commands.Network.Models.PSVirtualNetworkGatewayConnection in Microsoft.Azure.Commands.Network.format.ps1xml, or verify the default output display is correct."
"Cmdlet Output Validator","Microsoft.Azure.Commands.Network","Get-AzureRmVirtualNetworkGatewayConnection","3","The output type Microsoft.Azure.Commands.Network.Models.PSVirtualNetworkGatewayConnection for cmdlet Get-AzureRmVirtualNetworkGatewayConnection has properties that are complex types, this may result in unexpected siaply output.","Verify cmdlet output for Get-AzureRmVirtualNetworkGatewayConnection"
"Cmdlet Output Validator","Microsoft.Azure.Commands.Network","New-AzureRmVirtualNetworkGatewayConnection","1","Missing output format for cmdlet output type Microsoft.Azure.Commands.Network.Models.PSVirtualNetworkGatewayConnection","Add an output format for type Microsoft.Azure.Commands.Network.Models.PSVirtualNetworkGatewayConnection in Microsoft.Azure.Commands.Network.format.ps1xml, or verify the default output display is correct."
"Cmdlet Output Validator","Microsoft.Azure.Commands.Network","New-AzureRmVirtualNetworkGatewayConnection","3","The output type Microsoft.Azure.Commands.Network.Models.PSVirtualNetworkGatewayConnection for cmdlet New-AzureRmVirtualNetworkGatewayConnection has properties that are complex types, this may result in unexpected siaply output.","Verify cmdlet output for New-AzureRmVirtualNetworkGatewayConnection"
"Cmdlet Output Validator","Microsoft.Azure.Commands.Network","Remove-AzureRmVirtualNetworkGatewayConnection","0","The cmdlet Remove-AzureRmVirtualNetworkGatewayConnection has no OutputType attribute.  Please add an OutputType attribute for each of the types the cmdlet may output.","Add OutputType attribute for each output type of cmdlet Remove-AzureRmVirtualNetworkGatewayConnection."
"Cmdlet Output Validator","Microsoft.Azure.Commands.Network","Set-AzureRmVirtualNetworkGatewayConnection","1","Missing output format for cmdlet output type Microsoft.Azure.Commands.Network.Models.PSVirtualNetworkGatewayConnection","Add an output format for type Microsoft.Azure.Commands.Network.Models.PSVirtualNetworkGatewayConnection in Microsoft.Azure.Commands.Network.format.ps1xml, or verify the default output display is correct."
"Cmdlet Output Validator","Microsoft.Azure.Commands.Network","Set-AzureRmVirtualNetworkGatewayConnection","3","The output type Microsoft.Azure.Commands.Network.Models.PSVirtualNetworkGatewayConnection for cmdlet Set-AzureRmVirtualNetworkGatewayConnection has properties that are complex types, this may result in unexpected siaply output.","Verify cmdlet output for Set-AzureRmVirtualNetworkGatewayConnection"
"Cmdlet Output Validator","Commands.ResourceManager.Cmdlets","Find-AzureRmResourceGroup","3","The output type System.Management.Automation.PSObject for cmdlet Find-AzureRmResourceGroup has properties that are complex types, this may result in unexpected siaply output.","Verify cmdlet output for Find-AzureRmResourceGroup"
"Cmdlet Output Validator","Commands.ResourceManager.Cmdlets","Get-AzureRmResourceGroupDeploymentOperation","3","The output type Microsoft.Azure.Commands.ResourceManager.Cmdlets.Models.PSResourceObject for cmdlet Get-AzureRmResourceGroupDeploymentOperation has properties that are complex types, this may result in unexpected siaply output.","Verify cmdlet output for Get-AzureRmResourceGroupDeploymentOperation"
"Cmdlet Output Validator","Commands.ResourceManager.Cmdlets","Invoke-AzureRmResourceAction","3","The output type Microsoft.Azure.Commands.ResourceManager.Cmdlets.Models.PSResourceObject for cmdlet Invoke-AzureRmResourceAction has properties that are complex types, this may result in unexpected siaply output.","Verify cmdlet output for Invoke-AzureRmResourceAction"
"Cmdlet Output Validator","Commands.ResourceManager.Cmdlets","Get-AzureRmResourceLock","3","The output type Newtonsoft.Json.Linq.JToken for cmdlet Get-AzureRmResourceLock has properties that are complex types, this may result in unexpected siaply output.","Verify cmdlet output for Get-AzureRmResourceLock"
"Cmdlet Output Validator","Commands.ResourceManager.Cmdlets","New-AzureRmResourceLock","3","The output type Newtonsoft.Json.Linq.JToken for cmdlet New-AzureRmResourceLock has properties that are complex types, this may result in unexpected siaply output.","Verify cmdlet output for New-AzureRmResourceLock"
"Cmdlet Output Validator","Commands.ResourceManager.Cmdlets","Set-AzureRmResourceLock","3","The output type Newtonsoft.Json.Linq.JToken for cmdlet Set-AzureRmResourceLock has properties that are complex types, this may result in unexpected siaply output.","Verify cmdlet output for Set-AzureRmResourceLock"
"Cmdlet Output Validator","Commands.ResourceManager.Cmdlets","Get-AzureRmPolicyAssignment","3","The output type Newtonsoft.Json.Linq.JToken for cmdlet Get-AzureRmPolicyAssignment has properties that are complex types, this may result in unexpected siaply output.","Verify cmdlet output for Get-AzureRmPolicyAssignment"
"Cmdlet Output Validator","Commands.ResourceManager.Cmdlets","Get-AzureRmPolicyDefinition","3","The output type Newtonsoft.Json.Linq.JToken for cmdlet Get-AzureRmPolicyDefinition has properties that are complex types, this may result in unexpected siaply output.","Verify cmdlet output for Get-AzureRmPolicyDefinition"
"Cmdlet Output Validator","Commands.ResourceManager.Cmdlets","New-AzureRmPolicyAssignment","3","The output type Newtonsoft.Json.Linq.JToken for cmdlet New-AzureRmPolicyAssignment has properties that are complex types, this may result in unexpected siaply output.","Verify cmdlet output for New-AzureRmPolicyAssignment"
"Cmdlet Output Validator","Commands.ResourceManager.Cmdlets","New-AzureRmPolicyDefinition","3","The output type Newtonsoft.Json.Linq.JToken for cmdlet New-AzureRmPolicyDefinition has properties that are complex types, this may result in unexpected siaply output.","Verify cmdlet output for New-AzureRmPolicyDefinition"
"Cmdlet Output Validator","Commands.ResourceManager.Cmdlets","Set-AzureRmPolicyAssignment","3","The output type Newtonsoft.Json.Linq.JToken for cmdlet Set-AzureRmPolicyAssignment has properties that are complex types, this may result in unexpected siaply output.","Verify cmdlet output for Set-AzureRmPolicyAssignment"
"Cmdlet Output Validator","Commands.ResourceManager.Cmdlets","Set-AzureRmPolicyDefinition","3","The output type Newtonsoft.Json.Linq.JToken for cmdlet Set-AzureRmPolicyDefinition has properties that are complex types, this may result in unexpected siaply output.","Verify cmdlet output for Set-AzureRmPolicyDefinition"
"Cmdlet Output Validator","Commands.ResourceManager.Cmdlets","Find-AzureRmResource","3","The output type Microsoft.Azure.Commands.ResourceManager.Cmdlets.Models.PSResourceObject for cmdlet Find-AzureRmResource has properties that are complex types, this may result in unexpected siaply output.","Verify cmdlet output for Find-AzureRmResource"
"Cmdlet Output Validator","Commands.ResourceManager.Cmdlets","Get-AzureRmResource","3","The output type Microsoft.Azure.Commands.ResourceManager.Cmdlets.Models.PSResourceObject for cmdlet Get-AzureRmResource has properties that are complex types, this may result in unexpected siaply output.","Verify cmdlet output for Get-AzureRmResource"
"Cmdlet Output Validator","Commands.ResourceManager.Cmdlets","New-AzureRmResource","3","The output type Microsoft.Azure.Commands.ResourceManager.Cmdlets.Models.PSResourceObject for cmdlet New-AzureRmResource has properties that are complex types, this may result in unexpected siaply output.","Verify cmdlet output for New-AzureRmResource"
"Cmdlet Output Validator","Commands.ResourceManager.Cmdlets","Set-AzureRmResource","3","The output type Microsoft.Azure.Commands.ResourceManager.Cmdlets.Models.PSResourceObject for cmdlet Set-AzureRmResource has properties that are complex types, this may result in unexpected siaply output.","Verify cmdlet output for Set-AzureRmResource"
